review_id,review_comment,review_create_date_time,review_overall_classification,review_user_id,review_wifi_spot_id
94b9ee1e-3384-4a88-b1e0-440401741986,"A nesciunt nemo. Sit harum eligendi. Quos autem blanditiis. Labore voluptate hic fuga.",2022-07-26 10:38:34,1,d0d325a1-c660-4a20-b5cd-cbef325dd834,6703f4e7-203f-40fb-9ea5-7fc180c6c999
e5c7f4de-97ab-4870-9501-b50d227e6f02,"Corporis minus necessitatibus cupiditate. Eligendi necessitatibus natus culpa rem quae.",2021-12-04 09:31:04,2,d0d325a1-c660-4a20-b5cd-cbef325dd834,6807522a-76fb-4bfe-b5e3-75381a6832fd
08e6986f-430c-4e23-a899-e30a934c106d,"Consequuntur molestias amet consequatur. Sint voluptate atque maxime voluptate non.",2021-04-16 19:00:25,4,d0d325a1-c660-4a20-b5cd-cbef325dd834,8dae3069-d724-4918-97ca-0c245dd28937
b62d9a43-117b-4115-9727-69a717be2764,"Corporis vero optio eos architecto id recusandae. Nostrum sunt est aperiam laborum.",2022-11-11 01:26:59,3,d0d325a1-c660-4a20-b5cd-cbef325dd834,70f6e315-d31a-4cb2-bbfe-f2272eef5ee1
2dc8dd10-4f00-4ebb-8d35-274a678af32d,"Aliquam totam quis libero. Modi fugiat harum dignissimos culpa assumenda quo.",2022-09-08 09:02:11,5,d0d325a1-c660-4a20-b5cd-cbef325dd834,50947f16-7f78-43ec-b617-ddef2dca41c4
b4d81d62-bd72-4899-9c6f-7703e256df9e,"Velit a soluta ullam velit tempore earum. Quia cumque aliquam alias recusandae.",2020-01-31 13:19:30,5,d0d325a1-c660-4a20-b5cd-cbef325dd834,15d24537-b356-41f5-8203-d745effe54af
5e68f151-ff50-4325-ac9d-4780818ee739,"Aspernatur quasi perspiciatis culpa nam. Architecto rerum mollitia.",2020-10-25 21:21:45,5,d0d325a1-c660-4a20-b5cd-cbef325dd834,7f2ac558-521e-485b-af9d-1ef5ea5bb5d5
29ace69a-fa38-4790-96dd-e914ab899c41,"Nulla exercitationem est animi earum ex ad voluptatum.",2022-10-05 21:26:19,1,d0d325a1-c660-4a20-b5cd-cbef325dd834,40ee6d73-42c2-494a-9916-3f28ff958f2b
3f021966-68a6-4aa6-a1a7-bbe0a1ec4ef0,"Mollitia officiis consectetur id. Fugiat tenetur nobis amet.",2020-05-14 17:53:17,3,d0d325a1-c660-4a20-b5cd-cbef325dd834,a12ed164-5af2-4c5a-9ec9-5adfeb336baf
ecc26a88-83b7-4597-a37b-ea3ee2b7c454,"Voluptates numquam error quis qui expedita. Deleniti ratione corrupti accusantium recusandae.",2021-01-25 18:37:28,5,d0d325a1-c660-4a20-b5cd-cbef325dd834,7d1cc506-62c1-418a-b9a8-b7a1d4e2ee84
b3efa5b9-3896-470f-91ad-4a9c0970900a,"Mollitia accusantium pariatur illum repellendus. Alias recusandae maiores id.",2022-06-27 05:38:46,4,d0d325a1-c660-4a20-b5cd-cbef325dd834,35b06631-77bf-4fb0-bfc6-517e7d87c645
5bae1301-104c-4030-8aac-7503b41f2e8a,"Cupiditate dolores eveniet nostrum facilis nisi cum. Commodi nam adipisci eius.",2023-03-12 01:34:33,1,d0d325a1-c660-4a20-b5cd-cbef325dd834,239248ad-835e-44f1-8220-aa6b9ce9235f
d507a113-43e0-46b9-befa-f9346060b5f8,"Dolor explicabo explicabo.",2020-08-09 06:48:47,3,d0d325a1-c660-4a20-b5cd-cbef325dd834,9b6c5af9-0e3c-4a33-a2a3-b2b8d86ad5fc
aa8d2c52-fc51-481b-9ee1-7222e325f56a,"Fugiat porro occaecati. Hic eos provident odit cumque ullam possimus. Fuga dignissimos est nobis.",2021-07-10 01:25:06,2,d0d325a1-c660-4a20-b5cd-cbef325dd834,c00a6698-4437-48b1-a9be-21ea36222992
b547d53e-b997-4dd2-8aba-ef775b2919b0,"Iure sapiente amet ea illo nulla.",2021-08-01 21:33:47,4,d0d325a1-c660-4a20-b5cd-cbef325dd834,aca4358e-4ec8-4a5c-9427-404ae0fa3316
31c595cf-7d58-44f8-a6b1-c183ca24e60e,"Praesentium animi omnis rerum similique maiores. Neque iure illum quasi.",2022-08-29 07:35:28,1,d0d325a1-c660-4a20-b5cd-cbef325dd834,b1983c98-b12a-4675-adf4-a1fda904f304
9df1d3cc-21b6-4600-8203-2338deeb5523,"Ipsum voluptate maiores dolores ad aliquam. Libero harum eos quod explicabo.",2024-05-17 08:11:52,1,d0d325a1-c660-4a20-b5cd-cbef325dd834,4679c7ce-7099-4288-9bd1-f19eec17a9cd
70926dc5-6559-450e-9a04-8b803775a0be,"Doloribus sit harum. Qui cumque animi adipisci fuga. Exercitationem quod nobis.",2020-04-29 12:44:00,2,d0d325a1-c660-4a20-b5cd-cbef325dd834,2c34478d-b026-4620-b499-053cec585604
356854bc-31d4-4afd-bcc5-9bc8fc6bd100,"Quis ducimus quaerat vero laboriosam deleniti.",2021-11-26 01:58:16,4,d0d325a1-c660-4a20-b5cd-cbef325dd834,28109505-47bd-4984-b74a-2f489dc52cfc
2e3f32cd-54b5-4802-9ca2-8a8aca41950f,"Adipisci corporis repellat ab error error. Quos ratione fuga in sed molestias.",2025-03-24 09:26:07,5,d0d325a1-c660-4a20-b5cd-cbef325dd834,66bd00da-e125-4792-bad1-fe858ffa9f47
90bb1d6b-e16a-458f-8284-d1bd1df6eb03,"Error ea cupiditate fugit minima sed veniam sit. Dicta voluptate officia distinctio hic.",2024-12-07 02:46:35,2,d0d325a1-c660-4a20-b5cd-cbef325dd834,6fdccb73-2b71-4932-96d8-33e1566e3370
8cf6f334-771d-4264-ac67-82a2373a29b5,"Provident exercitationem accusantium eius dolores. Facilis velit totam exercitationem.",2022-06-15 14:18:45,1,d0d325a1-c660-4a20-b5cd-cbef325dd834,7e460518-6ab1-41fc-b14e-06f346c92b34
1bcbbcea-26af-42df-b7ef-0ce9a2607418,"Omnis dignissimos beatae porro autem tenetur. Illum debitis esse laboriosam.",2023-04-25 03:22:35,3,d0d325a1-c660-4a20-b5cd-cbef325dd834,e36abedb-fdb3-4591-9ce6-aea52ed0c3e2
6377c84f-4622-4ff2-9246-5cd9b7c12903,"Eaque inventore sed fugiat. Occaecati ipsum rerum sequi perspiciatis hic.",2020-02-14 17:44:47,3,d0d325a1-c660-4a20-b5cd-cbef325dd834,adb39efa-026c-4f9a-a990-add9a2ffef39
08e9b1c4-0b4f-448a-8c55-fa8ac73540e0,"Ratione ullam quos dolores cum natus. Sit quo at.",2021-12-29 18:17:50,1,d0d325a1-c660-4a20-b5cd-cbef325dd834,e287fd62-fc42-4c74-89f7-9edae75bfc5c
d2989875-3bd3-4bc7-9e26-d27689e2878d,"Soluta fugiat culpa. Est sint beatae quidem sed ipsam consequatur. Culpa voluptatum fugit id.",2022-02-19 14:50:23,3,d0d325a1-c660-4a20-b5cd-cbef325dd834,f65b7f8b-9107-43e8-9fec-0c151cd0e3a1
a50b7d1c-6907-4522-8a33-2f28ba1054b9,"Sit aperiam velit inventore. Aut exercitationem distinctio. Excepturi porro at dignissimos.",2022-11-24 20:50:45,4,d0d325a1-c660-4a20-b5cd-cbef325dd834,609303c4-35d0-4bef-827f-efbc45bdfd3b
f2f38477-41a1-4c01-9ef9-a2d15372abdc,"Eum ullam harum est. Odio id voluptate vel.",2022-12-29 14:59:30,4,d0d325a1-c660-4a20-b5cd-cbef325dd834,dc419a15-eec1-4a80-b861-1cf9626c4493
0258ff10-60f7-47e1-8d25-c1df32477daf,"Soluta laudantium magnam perspiciatis nesciunt.",2023-11-21 14:55:10,5,d0d325a1-c660-4a20-b5cd-cbef325dd834,5bbe8e26-d053-4dc9-bab1-478ef1e84473
cf5c4eb5-392b-4328-96d5-847d70e7d603,"Temporibus sed cupiditate quaerat libero.",2024-07-28 04:27:41,5,d0d325a1-c660-4a20-b5cd-cbef325dd834,dc1fef48-06b0-43b1-b158-7e909679ebb1
89082f64-bb0e-46fd-ab5e-7766c368d877,"Praesentium ipsum ipsum. Qui cupiditate consequatur quam ad.",2023-10-27 12:16:16,5,d0d325a1-c660-4a20-b5cd-cbef325dd834,d4688066-3dfb-4ee7-b04d-d97da78ab9a8
2efd72aa-b35a-4a3c-983a-733015d8aa88,"Totam temporibus repellendus inventore repellendus ipsa. In tempore recusandae odio amet ut vel.",2023-01-06 10:36:50,3,d0d325a1-c660-4a20-b5cd-cbef325dd834,f6e03223-b4f2-4627-bf5d-ab5edf3ae6d3
8f25e2e4-8cb0-4297-ba60-5dee5a18c7d7,"Dolores numquam animi sunt itaque. Iure nulla odio eos.",2020-09-03 01:51:23,4,d0d325a1-c660-4a20-b5cd-cbef325dd834,a7e86fbd-ce94-4707-a314-91c3693704c5
7f4030b2-9b19-4884-8793-e33e4502b237,"Quo impedit aliquid libero odio iusto eveniet.",2022-04-10 15:02:49,3,d0d325a1-c660-4a20-b5cd-cbef325dd834,8950c2ab-b66a-49eb-bfd8-d80b4c55ff1b
cd119f7c-ddec-4870-9f9b-e310fa2d54ec,"Veniam modi provident harum perferendis. Neque omnis ea animi accusantium placeat.",2021-01-13 22:10:42,2,d0d325a1-c660-4a20-b5cd-cbef325dd834,faf8452c-f713-4df9-8671-4302789f728d
953f7258-fa8c-431c-9295-81aa4a9d323e,"Sint expedita veniam doloremque.",2021-04-12 20:58:59,2,d0d325a1-c660-4a20-b5cd-cbef325dd834,3ed054d7-a36d-40d8-9f2d-f7e3c5f9b56f
94e986b2-d1ef-4caf-b262-eb487f7e6b9e,"Possimus recusandae est unde error ipsum asperiores.",2021-11-13 16:06:40,3,d0d325a1-c660-4a20-b5cd-cbef325dd834,e07f3c43-db57-4f7f-9d98-6443f1a06d59
e4b105fe-95bb-46d4-90c7-fcc68657bdf6,"Laudantium minus delectus facilis deserunt eveniet.",2022-11-28 15:25:04,2,d0d325a1-c660-4a20-b5cd-cbef325dd834,3c27fd3c-3c17-4496-866f-654d74829352
bb3d4f77-e6b2-4814-b709-9abe53576d3f,"Totam veniam ut doloribus eum error doloremque. Voluptatem illum quis temporibus sequi.",2020-08-01 21:36:04,5,d0d325a1-c660-4a20-b5cd-cbef325dd834,2f785c31-1e8a-4ab0-8517-1dd9f20a725e
892e66bf-7a21-497f-9a50-463d616b871f,"Rem nam saepe qui sint tempora neque. In incidunt ea sed.",2020-07-05 18:43:38,1,d0d325a1-c660-4a20-b5cd-cbef325dd834,b96fa82e-8a87-446a-935e-112820075310
6aa04919-ca61-4f18-ac85-4a92b20a2fd4,"Illo nihil nesciunt perspiciatis. Inventore repellendus quidem.",2022-02-23 05:56:22,5,d0d325a1-c660-4a20-b5cd-cbef325dd834,354c628e-298e-4cde-8ce1-f7a4ad6b2abd
3362441b-503a-4b48-8053-53d5847ad750,"Vel excepturi voluptatibus deserunt.",2021-01-06 14:42:27,3,d0d325a1-c660-4a20-b5cd-cbef325dd834,c1680106-9f02-438a-9027-1b94b0c6710a
193cf490-728d-474b-ab14-ead4980760d8,"Corporis ipsam in quibusdam. Sit earum illum saepe repellat dignissimos cumque.",2023-01-27 20:15:22,1,d0d325a1-c660-4a20-b5cd-cbef325dd834,9a9e2ae3-35e7-4886-ae73-125eb93354ff
dc3ff4ef-77f3-4048-aefd-01dbf9ef73c8,"Sunt quas quisquam perspiciatis alias necessitatibus esse. Error similique debitis error.",2022-07-03 19:05:56,3,d0d325a1-c660-4a20-b5cd-cbef325dd834,87916732-6918-40a3-98a3-450c86078f1c
e4e2e244-cccf-4bab-91b5-facff5fcec59,"Quos error ratione reprehenderit. Aliquam dicta ducimus et.",2024-09-05 19:47:04,3,d0d325a1-c660-4a20-b5cd-cbef325dd834,cd8bca7e-70fe-4ecb-8a3b-8678b6467897
eb47ec79-b5a9-486c-923b-097a23518a28,"Modi fuga impedit consequuntur sapiente aliquid vero quaerat. Occaecati quasi perferendis.",2023-04-05 15:17:44,5,d0d325a1-c660-4a20-b5cd-cbef325dd834,be4fd150-4609-47d9-b59a-30323055ba8d
1166c1fb-d4ea-4a73-8e2f-aa7048d93a80,"Vel optio corporis cum praesentium facilis commodi velit. Assumenda odit sequi.",2021-07-04 10:34:57,3,d0d325a1-c660-4a20-b5cd-cbef325dd834,8154d97a-f491-43ac-8149-22645d7d9b47
3eafa405-2613-49cf-95f2-e13bd5f56e0a,"Adipisci placeat suscipit unde explicabo vero aliquid. Animi nulla esse magni provident.",2024-09-15 23:07:26,2,d0d325a1-c660-4a20-b5cd-cbef325dd834,5253fc77-aec4-4158-968b-ffa612b542ae
efd28143-93a3-49bf-a215-729714904c40,"Quidem consectetur nemo rerum deleniti.",2024-04-21 16:43:02,5,d0d325a1-c660-4a20-b5cd-cbef325dd834,3578116e-b054-47ee-964e-5430d67e9021
f94c5001-0b31-4144-9df7-1d3791c5c172,"Architecto ea cumque nulla provident incidunt soluta. Esse beatae soluta mollitia.",2024-12-12 23:36:56,4,d0d325a1-c660-4a20-b5cd-cbef325dd834,10107fdd-0773-4f49-a833-d5cc487a8f11
3439662c-7029-4e29-b995-f7a2a7a6b4b6,"Fugiat ratione deleniti.",2022-11-16 18:34:28,1,d0d325a1-c660-4a20-b5cd-cbef325dd834,9cd58321-8a01-4138-9bca-954ae80d7e8c
e77ef653-5c5a-4925-adce-32833b49cff2,"Autem eligendi nesciunt. Nobis animi ad expedita voluptatem consectetur adipisci.",2022-03-19 07:53:58,4,d0d325a1-c660-4a20-b5cd-cbef325dd834,52c9452f-96cb-46cd-a2f6-2469da0fa098
dceb4277-b831-42fe-950d-76dc29738fe3,"Deleniti ullam ipsam quam ab nisi ratione. Explicabo minima pariatur.",2021-11-09 00:31:55,1,d0d325a1-c660-4a20-b5cd-cbef325dd834,a735dbc0-a3a3-4456-9192-cd5311c0aa5c
d883e4c4-1512-410a-9950-aa1db09e7da5,"Mollitia numquam quis ipsum error eaque. Ab ex facilis ut quod sit nobis.",2021-04-15 07:34:25,3,d0d325a1-c660-4a20-b5cd-cbef325dd834,951768d3-9699-4638-949c-75208a97999c
66dc83b6-4505-45a6-b718-e2d25fc38245,"Natus iusto alias officiis sequi dicta deserunt ullam. Dolorem excepturi quam rem ex enim.",2022-08-19 06:06:03,1,d0d325a1-c660-4a20-b5cd-cbef325dd834,14553cc8-48e6-4af1-8c26-29cddb9f3696
e9633d6c-1cf6-4e3e-b414-056c03166b74,"Labore expedita modi impedit sed. Fugit ad expedita accusamus culpa.",2024-09-22 15:05:24,4,d0d325a1-c660-4a20-b5cd-cbef325dd834,61063b2e-b71a-4ae4-95a3-b596651fd967
ffee1a8a-6285-4474-9d57-887853404259,"Molestiae cumque corrupti distinctio possimus nisi. Atque odio possimus expedita autem.",2023-07-18 06:49:36,2,d0d325a1-c660-4a20-b5cd-cbef325dd834,b74534fe-37f8-4bfc-84b1-13a93d8d9f34
9e6370a9-2684-4eb5-b817-67282f3609d4,"Nihil quisquam autem rem. Saepe inventore amet quasi. Corrupti sequi asperiores autem.",2024-01-07 16:31:21,2,d0d325a1-c660-4a20-b5cd-cbef325dd834,eeee3929-5a5c-4ee9-a19c-d3317e58c883
dd69b716-5123-4d1f-8b22-ed47d25165ed,"Ab aut nostrum voluptatibus. Voluptatibus eligendi labore molestias doloremque totam quidem.",2024-10-22 08:21:02,4,d0d325a1-c660-4a20-b5cd-cbef325dd834,8ea119fb-372c-4332-9510-e73195e63ee5
0f69ecdf-683d-42cd-b5fd-66a9aa16da02,"Sit repellat qui assumenda voluptatem velit. Quidem aspernatur assumenda fuga sint molestias.",2024-07-15 12:07:40,1,d0d325a1-c660-4a20-b5cd-cbef325dd834,375bffac-44bd-471d-9fba-9010180b3e2f
b1984cc1-d245-4b5c-a4d0-854dfa058291,"Iure unde et tempora fugiat. Illum aut quae in. Voluptate rem quam repellendus aperiam esse.",2021-12-11 05:59:45,5,d0d325a1-c660-4a20-b5cd-cbef325dd834,2aded9c0-faca-4968-a2e5-716860e50b25
90fd014e-c60b-43e0-a6ae-79d4fd87233d,"Blanditiis iste dolores rerum quia. Nesciunt natus ea quidem nisi sed numquam aliquam.",2022-09-04 10:57:57,4,d0d325a1-c660-4a20-b5cd-cbef325dd834,d77d3d5c-524c-46db-a119-e6b27a5f4431
b16f9c2e-ff15-49bb-b3e8-1da4cb72f4e5,"Culpa facilis incidunt occaecati laborum perferendis. Dolore nobis praesentium a.",2022-04-02 06:18:33,4,d0d325a1-c660-4a20-b5cd-cbef325dd834,a82727e6-34d9-4693-a98a-b9838f99589e
e5f6c9d7-c936-4718-b277-f1ccf87bb930,"Autem reiciendis consectetur tempore reiciendis accusamus dolore. Libero quidem nobis.",2023-03-05 03:36:57,3,d0d325a1-c660-4a20-b5cd-cbef325dd834,87742848-a69d-4c80-8a6e-8367cb09ca9f
2ddf934e-c442-4828-bbc8-519ebe5b3219,"Quibusdam ab consequuntur esse repellat. Ipsam et dolorem aliquam.",2021-03-14 02:13:58,1,d0d325a1-c660-4a20-b5cd-cbef325dd834,8a393d3c-dfad-410b-8967-ce8cb88c72ac
c8431404-575c-4959-af2b-f8c3a2a9cc96,"Facilis cupiditate iste modi velit sint. Veritatis sit ut quam esse.",2024-02-17 14:46:30,3,d0d325a1-c660-4a20-b5cd-cbef325dd834,30485bd0-8bca-45bd-9253-b0b3dd2ec5ec
0d809b8d-6ea1-4189-a89c-3c35e9d7c501,"Sunt perferendis id sed quis. Rerum ipsa nostrum omnis.",2025-03-06 23:43:13,3,d0d325a1-c660-4a20-b5cd-cbef325dd834,3a501f3a-5830-47da-a00c-99c5065adcc4
fbd12703-d3f9-43cf-be81-3bca8a25026e,"Dolor sapiente perspiciatis dolorum. Autem reprehenderit fuga unde dolorum.",2022-09-24 21:02:30,2,d0d325a1-c660-4a20-b5cd-cbef325dd834,cd15a9bc-312c-430e-a4a5-5f62370c448c
82924927-6091-494f-9b24-b65439c1564b,"Dolore quae sunt. Natus illum enim aspernatur. Doloribus distinctio vero.",2022-09-16 21:49:01,2,d0d325a1-c660-4a20-b5cd-cbef325dd834,ee1ede64-b09a-4be2-9716-24d5bcdfdb79
1f3fdcde-305f-452c-ad81-e5569437457f,"Ipsa sed impedit molestiae pariatur totam. Dolorum omnis aut necessitatibus atque laboriosam.",2024-06-18 22:11:07,1,d0d325a1-c660-4a20-b5cd-cbef325dd834,621641be-1440-4f4a-874a-c523a4ad0c2d
1f6919c5-031b-4f96-badb-ced4aaf0c3f4,"Itaque beatae nesciunt nihil autem. Pariatur architecto eaque facere natus.",2024-06-29 16:38:39,4,d0d325a1-c660-4a20-b5cd-cbef325dd834,4f82ad5d-f566-4bd6-a9bc-f14d970aea5f
dbf5e639-3a6b-42fb-b08e-e8d67efe2897,"Molestiae error fuga possimus nesciunt quasi. Dolorem ad tenetur ex illo cumque.",2022-04-15 13:40:46,5,d0d325a1-c660-4a20-b5cd-cbef325dd834,02b71416-8a5f-44d8-ba64-421edb735da3
3b4b5e2a-6304-4b91-8536-f2719323018d,"Cum perspiciatis similique nisi pariatur enim accusantium. Qui fuga impedit ex.",2022-10-31 10:22:55,5,d0d325a1-c660-4a20-b5cd-cbef325dd834,d7c284c3-989d-4bd3-811c-f7a6db760819
0aea4d3c-1167-4874-af65-e0abded132f7,"Ullam rerum perspiciatis sapiente laudantium. Minima quam id.",2024-01-18 00:04:35,2,d0d325a1-c660-4a20-b5cd-cbef325dd834,ab725b32-d2e4-4e18-a34a-d0ef6b326bbc
4edf9d66-4ab0-4ab6-9d6a-e781969970cc,"Quod omnis tempora eum voluptates consectetur. Quia nam corporis quasi laboriosam quia.",2020-03-28 22:06:12,1,d0d325a1-c660-4a20-b5cd-cbef325dd834,b7552d6e-81dc-4cf9-9638-6ace3707badd
a69e71d7-6933-4015-b838-dfcac566d72b,"Eaque debitis debitis suscipit. Sit maiores laudantium ullam minima eaque.",2021-01-10 08:24:17,3,d0d325a1-c660-4a20-b5cd-cbef325dd834,e3ab8ca6-c660-4d95-866c-1a15a8933d06
9d4fa2f1-d68e-4397-9c52-8969bf89595b,"Perspiciatis cumque consequatur soluta atque.",2020-06-18 04:46:20,1,d0d325a1-c660-4a20-b5cd-cbef325dd834,fa7c70a8-b2cd-4d3a-99fd-3e3e213537ab
e2296f77-c234-462a-8c3d-d6177696d7b3,"Voluptatem architecto corrupti veritatis magnam natus occaecati nesciunt.",2020-04-13 13:23:36,4,d0d325a1-c660-4a20-b5cd-cbef325dd834,8d23835e-e785-46f0-b4e1-6f86c45190b7
b0a6534b-b1a2-4032-9581-103fd9a907b6,"Autem quo voluptatem sed numquam. At omnis aliquam nihil nostrum fuga.",2020-05-17 06:52:42,1,d0d325a1-c660-4a20-b5cd-cbef325dd834,2d572d66-960a-48c4-a799-ca2c02d94270
edf13e22-f3ca-4686-97b2-3728f4455eec,"Saepe necessitatibus unde atque.",2023-09-29 21:56:36,4,d0d325a1-c660-4a20-b5cd-cbef325dd834,0bfa46c8-6733-4c56-9d5f-adf12dfb8dfb
e70047ad-6d82-4ecd-841f-dadacd381e09,"Placeat temporibus ipsum nisi. Dignissimos id debitis voluptatem odio suscipit.",2024-11-28 11:26:49,1,d0d325a1-c660-4a20-b5cd-cbef325dd834,382968f3-c664-4a5f-97bc-df1af2a449be
8334be2a-b52b-415d-b994-dc6f8d358dc5,"Alias accusantium asperiores. Quo culpa nostrum quaerat repudiandae amet vel sint.",2024-10-16 00:02:56,5,d0d325a1-c660-4a20-b5cd-cbef325dd834,cf23bc93-f05f-4bf3-8aef-d9ce3424ed21
74f44ea7-5df9-40c4-be07-a64b5c334c37,"Molestiae debitis adipisci quo eius ad minus. Vero autem perspiciatis suscipit explicabo ea neque.",2024-10-19 17:57:31,1,d0d325a1-c660-4a20-b5cd-cbef325dd834,8f302cd9-9e73-443d-94d7-db9a67f341d7
3d2c0a89-76d5-4d03-ad94-df8473f47bf7,"Itaque qui odit natus quo ipsum vero. Sed ut consectetur laboriosam necessitatibus atque.",2023-09-20 21:47:14,1,d0d325a1-c660-4a20-b5cd-cbef325dd834,da865329-49fe-4a5c-abaf-222ef6149dd8
de1c2d30-f012-4941-bd41-567bef275ab2,"Voluptatum exercitationem doloremque a totam adipisci earum. Vel occaecati perspiciatis ratione.",2024-04-18 16:58:33,5,d0d325a1-c660-4a20-b5cd-cbef325dd834,1bd1c4ee-70c3-4601-9b0d-d455f92f3ba6
6eb8a68b-ccd1-44d1-816f-26aca5924e1c,"Quae ipsa similique laborum. Odio aspernatur magnam. Ullam accusantium odio.",2023-09-27 10:12:00,1,d0d325a1-c660-4a20-b5cd-cbef325dd834,6e8ab131-ba5a-4d8f-8e93-6de8c6ae24e1
5938dce5-9eaa-402b-9f74-ca650993e0ce,"Qui accusantium natus magni atque tempora.",2021-11-17 18:02:01,1,d0d325a1-c660-4a20-b5cd-cbef325dd834,47157400-3a35-492f-a571-7f9c3cddf21e
ae8906f3-d5f3-476c-929d-f075fcb4b09f,"Omnis quaerat mollitia sit voluptas culpa distinctio fugiat.",2024-11-18 04:52:27,3,d0d325a1-c660-4a20-b5cd-cbef325dd834,ce48069d-c3d6-4695-b292-5dde689380f2
b7e3e181-7ed1-4204-be5f-d6d2a91a0758,"Velit commodi numquam animi cupiditate. Quod nam praesentium ut.",2023-05-23 07:22:54,5,d0d325a1-c660-4a20-b5cd-cbef325dd834,c603258f-6626-41e4-9a91-fb00d6f02462
4f3e104b-1c24-4d16-8e52-6a501aa82a4d,"Veritatis commodi saepe dicta consequuntur.",2022-10-19 18:12:08,3,d0d325a1-c660-4a20-b5cd-cbef325dd834,7efa69e1-501c-411e-a20c-58b8208ba980
7398bd2c-a013-4955-9ca6-05bc6c11c5d3,"Modi sed illo quidem qui nihil. Earum rerum id. Et earum facilis modi delectus.",2024-08-31 09:03:18,4,d0d325a1-c660-4a20-b5cd-cbef325dd834,3263e563-79f4-4e14-9ae3-4654f038d65a
5f731ad0-e81f-414f-ab0d-04e7cf43c522,"Ea ea ut ipsum porro soluta ipsum ullam. Itaque esse incidunt esse soluta repudiandae nostrum ea.",2023-04-04 20:20:15,1,d0d325a1-c660-4a20-b5cd-cbef325dd834,648fb16a-f840-4a01-a4df-717d1b209d44
0057fa91-7b17-47ea-8f0b-671760dc00e1,"Deleniti et inventore maxime. Cupiditate occaecati a voluptatibus impedit.",2023-05-15 17:01:46,4,d0d325a1-c660-4a20-b5cd-cbef325dd834,95c831bc-2e53-419a-967f-1acdea17a31c
8c8177ef-5f03-46d9-9f21-9855b672a526,"Delectus quidem qui necessitatibus numquam maiores. Ab nam voluptatem labore debitis impedit.",2021-08-27 07:30:50,3,d0d325a1-c660-4a20-b5cd-cbef325dd834,0caadf08-e413-4985-b9c3-149243a503d2
acdf2776-021e-4f94-acc1-f3e617462738,"Deserunt vitae veniam in excepturi est nihil. Odio culpa pariatur officia quod.",2024-12-24 00:04:57,3,d0d325a1-c660-4a20-b5cd-cbef325dd834,ef654d63-6950-486d-b6f2-e5d5f5c5423e
7a85ec5f-a001-49d3-ae11-b90484cb7f41,"At doloribus molestiae illum optio quaerat rem inventore.",2021-10-16 04:43:38,3,d0d325a1-c660-4a20-b5cd-cbef325dd834,383ea1ca-8434-4036-8ead-426f9c409685
68201b76-c125-4d58-ae87-ee298718710f,"Officia beatae explicabo inventore minima.",2021-08-10 15:11:15,1,d0d325a1-c660-4a20-b5cd-cbef325dd834,c3151dd4-a841-44e7-937a-ef2fb6f7a2d0
0b5e1971-681c-431e-a0e5-ae8d514afb05,"Facilis ipsa optio. Quia perspiciatis nisi ad consequuntur.",2024-04-01 09:21:31,3,d0d325a1-c660-4a20-b5cd-cbef325dd834,41f66e58-021e-4e85-b9eb-43e8905060b3
987d2ec0-14c7-4216-8b51-9b4e8a5d01c3,"Nostrum provident quaerat sequi quas. Exercitationem numquam id cupiditate perspiciatis.",2024-12-09 15:59:32,4,d0d325a1-c660-4a20-b5cd-cbef325dd834,4f07694d-ac04-46da-9b4b-2284e78c0962
4660d87b-bbcc-4e45-9213-7f0ab20563e8,"Laudantium quia voluptate. Omnis quod veritatis cupiditate id non.",2020-05-28 02:58:49,3,d0d325a1-c660-4a20-b5cd-cbef325dd834,b677852c-0f11-4620-9517-05c3619c4d51
46b2a814-4a88-4e6d-ba23-2b318e272814,"Minus provident architecto odio ratione. Molestiae labore ex voluptatem corporis nesciunt.",2024-07-10 19:49:15,1,d0d325a1-c660-4a20-b5cd-cbef325dd834,82d9084c-c53d-4c18-9eed-6a82216a96f0
2fd79a8d-1271-4d1b-992d-e7bef84288a9,"Incidunt quibusdam accusantium incidunt tempore ex officiis.",2023-09-21 00:56:17,2,d0d325a1-c660-4a20-b5cd-cbef325dd834,dc264bdb-9991-48a4-b9cf-4c59e2a7b9d1
9d39bf1d-ed93-4046-b35f-bc8b15ec2e91,"Ab corporis quibusdam. Earum quis explicabo illo necessitatibus quo mollitia.",2025-03-14 19:45:32,5,d0d325a1-c660-4a20-b5cd-cbef325dd834,ac08f956-351b-41d4-bd06-fc7687945eb2
acf4ed60-eafc-406d-ab9c-0609526e758c,"Sapiente magnam impedit qui in alias illo. Qui est sunt velit.",2022-12-25 23:45:34,5,d0d325a1-c660-4a20-b5cd-cbef325dd834,e766c668-044a-4cfb-a0f2-82e3f984f694
672e9c15-a44b-4546-a650-c9be00a7e80b,"Occaecati ipsum sunt impedit nesciunt. Itaque quia quas temporibus.",2022-06-22 02:24:13,3,d0d325a1-c660-4a20-b5cd-cbef325dd834,f7851d85-0322-40eb-a2b6-fd2e00eba8b3
bfdd15fd-e375-4922-b40d-769fbb1cd01a,"Sed omnis saepe doloremque non porro facere. Animi sunt magnam facilis eos.",2024-02-13 18:47:30,4,d0d325a1-c660-4a20-b5cd-cbef325dd834,c6e25166-11fb-45d6-93f7-56849f230ffb
a234442b-678a-494c-95de-8090b095892e,"A doloribus veniam libero. Nam fugit atque earum. Labore animi recusandae dignissimos eligendi.",2023-07-08 22:52:37,2,d0d325a1-c660-4a20-b5cd-cbef325dd834,0ee55a76-7a9b-41bf-ad4f-b71ac70b0718
deca192e-c11a-4c97-b921-474ee9ca88ec,"Delectus tempore quibusdam nesciunt itaque nulla dolorum. Reprehenderit consequatur saepe placeat.",2022-04-23 02:47:52,2,d0d325a1-c660-4a20-b5cd-cbef325dd834,a5bf44fb-dca0-4f4b-acc9-ff3efc31c0a4
7b0e5bbf-fc9b-4431-9663-9487b27b8b8f,"Laborum odio doloribus animi aut repellat. Mollitia aspernatur architecto placeat ipsum.",2024-06-22 21:05:02,5,d0d325a1-c660-4a20-b5cd-cbef325dd834,72eaa69d-fd95-428d-9292-58fa0ed9daf9
223aa13d-3235-45f4-ab6c-2069fbaa182c,"Temporibus iusto eligendi ut. Eveniet voluptas culpa. Temporibus enim fuga molestiae aut impedit.",2025-01-01 02:51:42,5,d0d325a1-c660-4a20-b5cd-cbef325dd834,d4cdc9dd-ac6f-41d8-9be9-be4909760276
9f93d735-9c8e-4804-b24a-00adc036fb6f,"Adipisci et corrupti. Animi pariatur nobis assumenda molestias earum recusandae.",2024-02-05 13:35:17,4,d0d325a1-c660-4a20-b5cd-cbef325dd834,74d43449-fa15-482f-a306-edca85515c41
82b3b24b-0aca-4d20-80fa-5da5edce2d61,"Voluptatum expedita hic illo.",2025-02-18 23:32:33,3,d0d325a1-c660-4a20-b5cd-cbef325dd834,ff06dc65-8314-4cd1-958c-13fc4d52c637
1307178d-1ae7-4a08-a1e3-15894d891dcb,"Iusto quasi non modi laboriosam recusandae esse corrupti. Dolore quos odit dolorum eius.",2024-05-19 14:45:34,5,d0d325a1-c660-4a20-b5cd-cbef325dd834,59235d4b-ecbe-45aa-9aec-370165dc5ba8
40536764-5a0a-4e8d-afe3-f91e4a7c2489,"Occaecati ad error tenetur ex quibusdam.",2023-09-02 04:01:43,1,d0d325a1-c660-4a20-b5cd-cbef325dd834,2993ccca-e169-4797-85c2-28dd73a305f7
c93f6511-a9aa-420c-bb00-17903300294c,"Fuga quis nemo expedita. Consequuntur cumque fuga iusto.",2021-12-19 02:28:30,2,d0d325a1-c660-4a20-b5cd-cbef325dd834,27545b79-5639-4c8b-87f6-f5bf7fcaa7ab
579e23af-b34f-4274-9220-db2bb2aca68b,"Necessitatibus ea adipisci a dignissimos sit explicabo. Quod fugit nisi dignissimos eaque.",2023-06-02 15:47:03,4,d0d325a1-c660-4a20-b5cd-cbef325dd834,ab6f586e-f652-4706-b06d-111be15fc474
a3d1bc33-dbd5-444e-80c9-8908dc62a95e,"Sequi magni impedit fugit ea. Vel velit ratione animi.",2020-08-26 19:40:28,1,d0d325a1-c660-4a20-b5cd-cbef325dd834,a9f46197-dd77-42ff-8f83-f16fe3a313ff
a7e7ce18-3c3d-499a-ae5c-485e2076640f,"Reiciendis ad nobis ducimus et. Enim quo facilis repellendus. A est fuga rerum consequatur ad iste.",2022-06-12 16:53:51,4,d0d325a1-c660-4a20-b5cd-cbef325dd834,3015270a-0922-470f-9cd4-e5f0b73c4939
b8c15aee-3f92-4227-bdd2-1327b8558b82,"Labore necessitatibus error autem.",2023-02-08 04:34:35,5,d0d325a1-c660-4a20-b5cd-cbef325dd834,4d4b5420-d7bc-425d-9721-51f57408e98a
b1c2b6bd-f350-4c4c-9620-f6177d2edcd4,"Atque velit modi enim illo. Assumenda nihil occaecati. Animi sed culpa. Doloribus nulla molestias.",2022-06-01 16:37:54,3,d0d325a1-c660-4a20-b5cd-cbef325dd834,048a2cfa-80e0-4e84-b91a-82add79472c4
55d81158-e8e4-4cbf-a1c0-fd4cab159658,"Enim harum inventore facilis doloremque deleniti. Quis facere iste. Quo eius enim rerum.",2022-08-10 22:17:32,1,d0d325a1-c660-4a20-b5cd-cbef325dd834,a7867223-cc7b-4b4b-a221-3f6c0f9e4045
531ca729-fc3c-4ff4-a0ca-a024872abebf,"Deleniti molestiae animi quis fugit perspiciatis.",2022-02-22 10:50:19,1,d0d325a1-c660-4a20-b5cd-cbef325dd834,9590d92e-722c-49a0-939c-2b12bef0700f
e8d88636-bdec-4eb7-ac4f-59a522521283,"Amet non maiores assumenda.",2022-11-05 20:29:54,5,d0d325a1-c660-4a20-b5cd-cbef325dd834,cd041214-97ea-479f-9c20-241dbc4c972d
1eeba8a4-3128-43f5-a19f-7c56677bdad5,"Assumenda sed sapiente excepturi occaecati. Itaque molestiae mollitia voluptate.",2021-01-03 21:48:29,3,d0d325a1-c660-4a20-b5cd-cbef325dd834,4a4e2e47-bfcb-44c1-8acc-c5020dbf9a45
