review_id,review_comment,review_create_date_time,review_overall_classification,review_user_id,review_wifi_spot_id
67581c42-9e06-404b-80c9-f2f0a4cd4fdf,"Tempora quod nulla voluptatibus vero. Neque minus eius tempora. Omnis error quos quasi est nostrum.",2021-04-26 12:11:29,1,d0d325a1-c660-4a20-b5cd-cbef325dd834,01bd06fd-e962-4200-80a6-3175054ca008
39cf1027-0a11-46fa-9518-f789d3727d25,"At ab ut accusamus. Molestiae nam itaque eum sunt magni.",2020-08-02 06:06:29,4,d0d325a1-c660-4a20-b5cd-cbef325dd834,607772f6-f05f-42ee-a733-8fb6a07311c5
a5be66fa-0400-43ac-9c36-f2aebde69370,"Atque voluptatum odio deserunt. Velit porro reprehenderit porro dolorem.",2024-07-06 03:01:37,3,d0d325a1-c660-4a20-b5cd-cbef325dd834,3f69c684-61e8-46f7-876b-af08fb553e15
01d12355-4c00-4a93-982b-1a1734d81f85,"Blanditiis numquam quod expedita. Enim asperiores aliquam consequatur quidem doloribus.",2023-12-31 16:55:10,4,d0d325a1-c660-4a20-b5cd-cbef325dd834,2b77c262-7491-41ae-afdd-685eccf58f49
8392f9af-e6cd-4275-9c97-1c16d8555c1c,"Mollitia quam autem voluptatibus rem corrupti doloremque. Libero id fugit in quod repellat at.",2022-08-12 06:18:47,1,d0d325a1-c660-4a20-b5cd-cbef325dd834,07ac3fb0-06ad-4e65-8bf2-17f99bbe8ae2
0feb2bc7-0d05-42ae-b77e-5d3468ce2773,"Non illum officiis quis vero eos odit. Optio perspiciatis possimus dolorem cum.",2024-11-14 08:17:01,1,d0d325a1-c660-4a20-b5cd-cbef325dd834,2c1c561f-9028-4544-b7a8-4b286a875f38
c961c37f-7d47-4d47-97d2-89c8260d7968,"Dolore voluptatem doloremque eos. Magnam magnam molestiae.",2025-01-26 13:51:49,5,d0d325a1-c660-4a20-b5cd-cbef325dd834,ecdf4011-e93d-4037-adad-c8723b0f98ca
c7568d8f-8e56-46b3-b97a-8fd126e4f14b,"Vel perferendis fuga. Numquam commodi assumenda dicta.",2024-03-15 20:16:13,5,d0d325a1-c660-4a20-b5cd-cbef325dd834,fcfd95a9-5d36-429a-96f8-f9a73a7a7d3a
fbdcaec2-bd6f-46ce-a828-a5d3a55fce42,"Magni esse tempora facilis illo aut.",2020-04-29 10:24:01,4,d0d325a1-c660-4a20-b5cd-cbef325dd834,a6d8b35f-0450-47a6-83e9-89ff1df6389a
2e827f01-d959-4c67-9701-748f08c7e1dd,"Error corporis accusamus tenetur explicabo. Nesciunt temporibus optio quidem ex id rerum.",2020-08-22 20:56:06,3,d0d325a1-c660-4a20-b5cd-cbef325dd834,ac7ba32f-7e5d-4676-8ea9-b0e4853b2849
9c0662fb-f174-411c-ac77-98a02982571c,"Quis ea eaque temporibus non. Excepturi ducimus quasi necessitatibus pariatur doloribus quae.",2023-11-12 04:39:26,3,d0d325a1-c660-4a20-b5cd-cbef325dd834,d50cd8f7-d79e-4ac6-9298-76178f2f31f5
05bcce3b-f173-4e66-a608-79ec8cc1ca18,"Aut ipsa voluptatum perferendis velit. Alias eveniet doloremque nemo mollitia consequuntur sint.",2021-01-16 15:21:12,2,d0d325a1-c660-4a20-b5cd-cbef325dd834,c3502a02-13f7-4a29-88af-409176fe7f1c
7a8c8641-3b0d-450e-a37a-6ab3c7fc02ce,"Error odit a eos asperiores deserunt pariatur. Delectus quo molestiae quaerat vitae maiores.",2020-10-08 15:54:14,4,d0d325a1-c660-4a20-b5cd-cbef325dd834,8ad58f0b-45dc-4e33-b1c3-138323b42883
9f596e07-b01f-4058-b72b-a224405dff7f,"Repellat atque perferendis.",2024-10-14 17:39:22,4,d0d325a1-c660-4a20-b5cd-cbef325dd834,1099a918-9002-45ef-b13d-19877fd7ceea
2aba5dec-f5d1-4d90-810c-635afe654eb5,"Occaecati porro ipsum eveniet natus voluptas saepe. Iusto id id praesentium beatae.",2021-01-03 21:36:35,5,d0d325a1-c660-4a20-b5cd-cbef325dd834,4d43992f-116a-4029-a3f4-369f18bd2d64
5557e35b-7814-4a29-84b6-738c382f8d1c,"Aut veniam tenetur. Incidunt laboriosam autem alias dolore provident.",2025-03-25 14:46:56,5,d0d325a1-c660-4a20-b5cd-cbef325dd834,a19bce7e-8e87-4350-9ada-2adeef3bb3e6
468216ca-bd56-403c-91fa-6ec8b256ff5a,"At deserunt veritatis odit reprehenderit. Magni laborum fuga consectetur minima.",2025-01-03 14:39:38,4,d0d325a1-c660-4a20-b5cd-cbef325dd834,08c589ad-d177-4b10-9e46-c4b5a5ec2bd3
7335bc30-d5d2-44f0-b672-82ae47e4a8b0,"Officia modi animi dolorum. Non impedit perspiciatis nam.",2021-06-24 19:31:32,1,d0d325a1-c660-4a20-b5cd-cbef325dd834,1e6b08b1-7f59-4391-82d5-ba908632db4a
e1d33297-2695-480a-9252-a8c283baa090,"Quas quae quam praesentium vero. Totam veniam magnam blanditiis ut.",2023-10-23 00:52:54,5,d0d325a1-c660-4a20-b5cd-cbef325dd834,e3b55341-b2f6-4b24-a155-b25bdaf7eada
d1beebb3-b44e-4e09-8baf-575061cae5d3,"Fugiat accusantium eaque incidunt debitis autem. Eius repudiandae cum accusantium neque incidunt.",2023-05-05 14:18:00,1,d0d325a1-c660-4a20-b5cd-cbef325dd834,8bebefcd-3d3f-436e-8fa4-e195e785ad06
1a0ffac0-c9fc-451e-b6a1-f69c83430573,"Nihil nam ipsa distinctio dolorem cumque.",2021-04-24 10:54:18,5,d0d325a1-c660-4a20-b5cd-cbef325dd834,3bc10e72-7675-4a58-bc33-fa02bedadf7b
95f84e66-32c9-44af-990f-d0ebc0504836,"Repudiandae quia ex. Numquam eligendi magni quis. Facere ullam explicabo delectus enim.",2021-03-14 14:13:26,4,d0d325a1-c660-4a20-b5cd-cbef325dd834,29f41ae0-4a52-4794-b8bd-151104b07c26
30517e1e-afc9-412a-9b11-f87a1ac1c47f,"Eligendi magnam harum repudiandae. Explicabo commodi illum quod.",2020-06-17 19:28:13,5,d0d325a1-c660-4a20-b5cd-cbef325dd834,2bdf5c11-07eb-4970-b269-132ca4173a1d
eaa9a96d-2e40-440d-9055-f05542246f4d,"Cum voluptatibus ut tempore recusandae. Eum molestiae deleniti.",2025-04-23 01:01:19,5,d0d325a1-c660-4a20-b5cd-cbef325dd834,6acb3486-8dd3-4932-a750-23064537c9f3
006f8617-c430-4501-bdaa-a0fe2409d556,"Cupiditate dolorem quas beatae nesciunt eius. Natus aperiam rerum debitis doloribus.",2022-06-23 17:18:36,1,d0d325a1-c660-4a20-b5cd-cbef325dd834,49a5949c-e18f-4f71-9fc4-66eb204a2a08
72a460e8-0b25-4255-b6ce-5c17112819a0,"Ipsum dolore facilis similique. Laboriosam hic adipisci.",2020-08-05 00:10:20,1,d0d325a1-c660-4a20-b5cd-cbef325dd834,6d32c74e-c52f-40e5-b874-b09bb139b5ef
42bb6c67-2972-4955-a586-228c62a5c975,"Optio cumque vero saepe dolorem. Ratione assumenda esse earum doloremque molestiae.",2023-01-08 03:15:45,4,d0d325a1-c660-4a20-b5cd-cbef325dd834,98c91e22-6028-4811-96f8-49dcb01cb855
820ebb75-9641-4b79-9f7d-b124e8b809a8,"Eaque minima tempora adipisci repellat. Porro praesentium suscipit harum eveniet.",2021-09-26 22:26:02,1,d0d325a1-c660-4a20-b5cd-cbef325dd834,2d7f1ccb-3783-42fa-b7b1-c4d8c96a1618
bd5d1baf-e87e-4b6c-94ba-3e3ecf2d2bf8,"Dignissimos placeat consequatur vitae ab debitis cum ab. Labore minus ad nulla illum sapiente illo.",2024-07-05 15:24:32,5,d0d325a1-c660-4a20-b5cd-cbef325dd834,097289e6-eab0-4548-a9d3-b34e7c46432f
920f0a56-ab97-4cee-b733-7a8b286a9982,"Quasi autem ipsam laboriosam. Eaque neque maiores adipisci ea assumenda.",2024-09-23 12:02:20,5,d0d325a1-c660-4a20-b5cd-cbef325dd834,cc50aef7-77a5-4978-9f43-28bfbf360e55
15487e8b-3c0e-4b36-a592-9d50f8b224f9,"Cum veritatis quae accusantium magni. Atque debitis distinctio. Nobis a laboriosam quisquam.",2021-04-02 06:22:37,1,d0d325a1-c660-4a20-b5cd-cbef325dd834,a8dd82e0-2afb-4474-9111-4a174a497a03
bac9de2b-b977-41e9-b569-70ac767eaaad,"Odit tenetur officiis magni dolores ducimus blanditiis.",2023-11-13 04:33:52,1,d0d325a1-c660-4a20-b5cd-cbef325dd834,8dfd5d0a-c67b-4c22-8d0c-43ec7379d806
b2349c11-606b-4fce-a269-c98d2269b66f,"Voluptates nesciunt dolorem adipisci. Deleniti beatae at est.",2021-05-12 08:54:12,5,d0d325a1-c660-4a20-b5cd-cbef325dd834,77d1c3c3-75d4-4ee3-9797-c6d375485534
e680665f-87f8-4d58-a14b-e6f6a0e207e4,"Sapiente veniam earum provident. Ab vel dolore expedita unde unde. Dolor quae tempora harum iusto.",2020-06-06 03:55:39,3,d0d325a1-c660-4a20-b5cd-cbef325dd834,17230ee5-4bad-4035-b7f9-829f01fe9755
eb8a34e4-7c9e-4ccf-9e25-b511c5a97f02,"Non voluptatum sequi temporibus quo et. Architecto ab reiciendis consequuntur saepe.",2024-12-03 02:12:18,5,d0d325a1-c660-4a20-b5cd-cbef325dd834,12b52669-67b3-46f0-9a64-889c633cf06e
af0dae54-bee7-4b0a-92b5-14132e69f875,"Quis illum alias sint vel voluptatum tenetur. Maiores voluptates nobis.",2023-06-19 01:46:55,4,d0d325a1-c660-4a20-b5cd-cbef325dd834,792dd13d-bb58-4fdd-951e-787a9d31dd72
3c624557-e98a-49fe-b0ea-587d2567fd9c,"Consequuntur soluta perspiciatis nisi alias. Accusamus labore voluptatum illum dignissimos quam.",2022-12-30 07:13:06,3,d0d325a1-c660-4a20-b5cd-cbef325dd834,339ff45d-5684-4a7e-b027-226ebdb0d4a6
ae79901c-91cc-4cb2-807d-07caeae38bac,"Ea dicta harum labore odio autem. Nulla neque laboriosam totam.",2025-04-03 22:21:17,5,d0d325a1-c660-4a20-b5cd-cbef325dd834,fed58fd8-3394-41da-8868-6cbe133ca72b
99970e82-8470-41ee-ba8b-7dc87206cf9c,"Cupiditate eum itaque rerum.",2021-09-16 04:28:10,3,d0d325a1-c660-4a20-b5cd-cbef325dd834,96ada0e8-1e86-4a18-9eea-9c13eddacd0e
bff95ec4-2dd0-4d08-a44c-5b99b4c31c9e,"Soluta iusto unde qui non accusamus non. Dolorum enim voluptate nulla eaque.",2020-06-09 09:46:40,2,d0d325a1-c660-4a20-b5cd-cbef325dd834,290473e2-8f2d-401a-9e16-b6dbc9c94ff5
a5c91773-aafd-44f5-8d58-c21e29d92821,"Qui non magnam dicta dolores. Esse perferendis sed magnam magnam aliquid.",2024-06-24 11:29:14,2,d0d325a1-c660-4a20-b5cd-cbef325dd834,85d24c6e-d3e6-414a-b1d9-dd5fee4b74e1
6ca15cce-049a-44cb-9d13-f8bc8e09a691,"Esse expedita eligendi soluta. Quisquam iure cum.",2021-09-19 07:18:54,2,d0d325a1-c660-4a20-b5cd-cbef325dd834,3ff7ad83-c81c-437a-885d-17b9cc7557a4
d62e615e-1386-4079-b88a-0dc8be86c034,"Temporibus reprehenderit soluta dolor. Modi consequuntur voluptatem veritatis.",2020-10-26 05:22:20,3,d0d325a1-c660-4a20-b5cd-cbef325dd834,3a68f5f9-3a0c-4d65-bc35-ce525d60765e
1947ad2a-322e-487d-8eac-0c939aaeea03,"Optio quo perspiciatis dignissimos.",2023-05-11 08:18:43,3,d0d325a1-c660-4a20-b5cd-cbef325dd834,7b74afea-ff0c-4394-bcc5-444cd39303a9
2b376ed4-1833-464b-a854-ae3b2e3308d3,"Pariatur occaecati voluptas aliquid asperiores. Quam minus voluptatum nihil.",2021-03-09 10:10:08,5,d0d325a1-c660-4a20-b5cd-cbef325dd834,99e8e876-d4a4-4554-a1bf-5420cf5c3d60
707d4bce-93e2-4015-bbc4-ecb77b14fee5,"Qui voluptas pariatur iusto recusandae. Sunt illum nulla omnis. Quasi qui consequatur iste.",2024-03-26 15:49:27,1,d0d325a1-c660-4a20-b5cd-cbef325dd834,cdc5a944-e0ab-405b-8edb-1d1c90111b4b
13a31776-c27e-4f55-87eb-ba803c43e8e8,"Aut aliquam placeat. Similique ducimus in illo est. Sit eligendi quam quaerat eos quo dolorum.",2024-08-01 19:24:28,3,d0d325a1-c660-4a20-b5cd-cbef325dd834,166b1acb-8751-4050-ac60-770484071c39
e03121d2-2e8d-4459-b5ea-c3d6b5a3e52c,"Esse atque id. Nobis aut excepturi excepturi facilis saepe. Voluptatum dicta ullam deleniti ea.",2021-10-01 05:38:53,3,d0d325a1-c660-4a20-b5cd-cbef325dd834,aacc5562-9165-489f-9482-8f733d772f50
c58b41f0-9810-464b-a721-0b58e1fd95a6,"Eveniet esse id earum. Rem ea illum corrupti odio sed. Qui earum numquam.",2024-01-15 17:47:04,4,d0d325a1-c660-4a20-b5cd-cbef325dd834,471a1b67-ea13-4727-975d-d6db21918124
be47d7df-ad2d-499c-8c7f-cdf964de467f,"Officia veritatis rem corporis cumque. Molestiae dignissimos pariatur expedita.",2025-04-06 07:41:51,4,d0d325a1-c660-4a20-b5cd-cbef325dd834,877cf42d-4753-4497-9472-8d4ffa1e22a3
d5e045a9-0db6-41fe-aa67-0053b0058799,"Quasi dolor quae quos hic soluta saepe incidunt. Illo nam mollitia voluptatem voluptatem mollitia.",2021-01-18 05:35:36,5,d0d325a1-c660-4a20-b5cd-cbef325dd834,e0ceb271-f247-4a50-a406-8e37acf8df38
8108b34c-3e6c-437e-9880-79794827890d,"Alias eum exercitationem consequatur rem molestiae. Hic porro totam ipsa corporis.",2020-08-26 13:32:07,3,d0d325a1-c660-4a20-b5cd-cbef325dd834,02e790df-3ccf-4f6a-86c8-e7279c032db6
4584aaba-d1ea-4345-ab82-bef3f461a6ba,"Qui nihil animi maxime facere maiores.",2022-11-07 17:07:08,1,d0d325a1-c660-4a20-b5cd-cbef325dd834,507cb2b1-3169-4c69-8cc1-36c1ec1aa1c4
f2f799ef-34f6-42ec-b661-be6382265977,"Nihil natus aspernatur ipsam adipisci natus. Laborum ad architecto magnam. Voluptate in ipsum.",2022-05-07 12:14:45,1,d0d325a1-c660-4a20-b5cd-cbef325dd834,1ee372e9-3108-4b6d-a25f-78ac2d4fea25
8e5ff6dc-c5ea-494b-9757-2859e23c623e,"Esse quasi deserunt dolorum. Reiciendis iusto facere consequatur consectetur. Commodi vel rem.",2023-06-13 22:57:17,3,d0d325a1-c660-4a20-b5cd-cbef325dd834,f11f79d1-432c-47cd-8e91-6f1cd2bc4305
b06e8230-43db-4bbe-bc77-04f119729922,"Laudantium blanditiis debitis iste dolores et. Adipisci porro nostrum harum iusto labore provident.",2025-03-20 12:02:35,4,d0d325a1-c660-4a20-b5cd-cbef325dd834,c9333a04-ae56-4f68-86e8-b87b682548bc
4232bd31-7717-4690-a38d-650d87653751,"Tenetur nam laborum repellat cumque nam sint.",2020-06-26 16:30:45,2,d0d325a1-c660-4a20-b5cd-cbef325dd834,7158b3d5-298d-4950-a329-66c22e6f211a
21fe20a4-e8da-4e98-b7d2-67a68184c6cc,"Aliquam dolores repellendus maiores. Tempora ut laudantium assumenda consequuntur.",2024-06-11 21:10:07,1,d0d325a1-c660-4a20-b5cd-cbef325dd834,7d0ed132-512a-404f-a68c-5bf0f49beca3
299f4ade-99e7-4ccf-8934-cb01d0235029,"Quod ducimus officia aliquam soluta fugiat qui. Nihil dicta assumenda rem.",2020-05-15 14:41:27,5,d0d325a1-c660-4a20-b5cd-cbef325dd834,4667545f-0266-428a-a070-ea261a56238f
90a074e5-a7f3-4f30-a825-13c584795b0a,"Quo maxime fugiat blanditiis. Amet blanditiis delectus provident.",2020-03-08 20:28:22,3,d0d325a1-c660-4a20-b5cd-cbef325dd834,a6a617d4-d10e-4eb8-a5c6-9f1a688beb0d
2e656bb2-409f-4cec-909e-9de5280d64ca,"Provident dolor repellendus cum alias magni veritatis sequi. In maxime laborum quibusdam.",2024-10-31 15:22:39,4,d0d325a1-c660-4a20-b5cd-cbef325dd834,63c5e06b-b56b-48e4-a5fd-4d98f12f82b5
da73a562-f577-4a32-8bc7-efdc8dffb9ed,"Alias labore aperiam et sit ea a.",2023-06-05 14:08:26,5,d0d325a1-c660-4a20-b5cd-cbef325dd834,bbe4dc9b-0771-4133-89d1-65955245d74c
9e4a31b6-9e9b-41ba-b09d-08292faeb175,"Mollitia minima doloribus sit voluptate at. Illum ad id excepturi tempore harum.",2025-04-18 14:47:00,4,d0d325a1-c660-4a20-b5cd-cbef325dd834,009df05e-43ba-47ba-971f-5bf3eeba6ca6
cbf0673d-d423-4a10-a9b6-fc7b940723c1,"Tenetur temporibus omnis accusamus veritatis laboriosam. Harum magni error sed consectetur.",2022-01-17 17:33:11,3,d0d325a1-c660-4a20-b5cd-cbef325dd834,5e99e0f1-ebe7-479b-8e97-3fc16cb1ef68
f9f647c7-92a9-4e6c-8f10-43f3eeff0a2f,"Amet dolor impedit iure. Corporis adipisci voluptatem. Ea facilis cum pariatur.",2021-10-11 10:20:48,4,d0d325a1-c660-4a20-b5cd-cbef325dd834,36100ecc-d1c3-435c-8762-27a1456cf62f
64309b85-0b2c-4f3a-abf9-ea5e1c9cad4f,"Nam consequatur esse ab sapiente excepturi. Aspernatur voluptatibus quidem commodi facilis.",2021-02-18 01:04:12,5,d0d325a1-c660-4a20-b5cd-cbef325dd834,f9ac0ee3-f8fb-4927-b4d0-ad849aac6109
4055a9ad-444c-486f-8a01-c768e01c997c,"Autem alias perferendis porro vero animi odit. Expedita deserunt ipsam quaerat iste expedita.",2020-12-17 17:57:50,3,d0d325a1-c660-4a20-b5cd-cbef325dd834,2f7af286-43f7-42fe-a7cb-68ecaa70aa6b
795e7fbe-6811-4031-a14d-e0f8b7edbb57,"Vero debitis ipsum eligendi. Nulla autem rerum autem. Tempora ipsum impedit voluptatibus.",2020-01-23 23:37:36,2,d0d325a1-c660-4a20-b5cd-cbef325dd834,f947a8ca-a844-4e6f-a25d-e3836dda8aba
e7073e29-4639-42ef-85ac-d562551d3157,"Perferendis adipisci excepturi eveniet ab nam sint. Ad sapiente est a repudiandae.",2024-04-04 21:42:59,2,d0d325a1-c660-4a20-b5cd-cbef325dd834,44e5a8cb-f1f4-4262-8a81-068d5382cd0c
8a45e62c-c949-48b6-9c99-c4e6ba2d99b7,"Sed pariatur optio. Aut possimus excepturi temporibus. Necessitatibus repellendus odio.",2025-03-12 06:52:28,1,d0d325a1-c660-4a20-b5cd-cbef325dd834,242c7cea-6afe-4629-b05e-f8c3b85d788b
509df77f-ad27-4d15-b0be-e0b03f178897,"Ratione autem officia et.",2021-02-19 00:49:24,5,d0d325a1-c660-4a20-b5cd-cbef325dd834,85f92a6a-c997-429a-b6fb-eaaebff93563
2a254ba6-8f33-4ce9-be16-ebe47d323da6,"Porro cumque a aspernatur possimus. Maxime cum numquam repellendus.",2020-06-29 02:28:32,2,d0d325a1-c660-4a20-b5cd-cbef325dd834,c7253d46-b1ec-43d6-be9c-e6c194f051cf
f9205654-ef7e-49ce-b6ef-04a9d507f1ea,"Quam numquam aperiam minima sequi. Esse quasi dolores. In soluta quidem soluta.",2022-01-29 21:09:01,5,d0d325a1-c660-4a20-b5cd-cbef325dd834,73241398-282a-4743-ab93-fffe70b3da09
37680352-5e9f-4db9-88b3-3d60dcf5cf43,"Dolorum facilis animi enim. Dolorem temporibus culpa. Deserunt porro nam neque.",2020-03-10 22:33:29,4,d0d325a1-c660-4a20-b5cd-cbef325dd834,d83e267e-cd98-4fa8-a01b-b11a2ae7ae06
e886aeed-01c1-4568-9cc2-0197bf9c9d47,"Ipsam maxime reprehenderit necessitatibus ipsum. Eum nulla quibusdam cumque temporibus molestiae.",2020-05-25 22:08:14,5,d0d325a1-c660-4a20-b5cd-cbef325dd834,25c107d5-81ed-4117-9b03-68e4d318c146
0aa7254e-c9b8-4341-9f22-b789227e690d,"Necessitatibus est quae soluta. Eum sunt nesciunt reiciendis sapiente. Eius at possimus quis.",2024-10-06 09:21:05,5,d0d325a1-c660-4a20-b5cd-cbef325dd834,2a6d427e-9d10-4a23-b27d-eb23af16cf25
50888b8d-d644-4d9b-a892-b38d6d54c9ab,"Ab beatae molestias velit incidunt.",2021-10-15 18:26:37,4,d0d325a1-c660-4a20-b5cd-cbef325dd834,1233ff6a-b156-44e7-8df2-de5f505d1ae0
f2201317-b6f7-421e-9507-12ef054ce37d,"Dolorem magnam reprehenderit voluptatem sint nihil dolor harum. Quae unde occaecati minus quae.",2023-03-14 09:08:43,2,d0d325a1-c660-4a20-b5cd-cbef325dd834,b8d877ea-f2b7-4013-8dcb-904c115105d2
480d2de3-7ce5-418b-8134-2db0479ad404,"Tenetur suscipit natus modi possimus. Molestias labore odio doloremque quo sapiente odio.",2020-06-22 04:34:16,3,d0d325a1-c660-4a20-b5cd-cbef325dd834,4747fbd7-56e9-4791-8a13-c75b2304d3c1
304355e7-7578-45f0-a2ff-399044af5b9a,"Facere sint perferendis. Quis magni aperiam unde vero doloribus.",2021-09-19 05:46:13,5,d0d325a1-c660-4a20-b5cd-cbef325dd834,4a5520ec-f486-4252-aee1-11c48bd98d00
a6e6fed5-94a7-4d43-adbb-cdfbb74f435e,"Reprehenderit asperiores error soluta impedit. Itaque rem adipisci explicabo molestiae.",2023-04-06 09:48:22,1,d0d325a1-c660-4a20-b5cd-cbef325dd834,c15ce267-9b16-4574-b596-88cc297d233a
a60e6827-a298-40a4-9ca1-0a1cde4e52c5,"Nihil aliquam dignissimos sit error. Ducimus occaecati quisquam.",2025-02-22 11:56:28,5,d0d325a1-c660-4a20-b5cd-cbef325dd834,169c9b6c-bdd5-4b64-b9aa-b32e38443d1b
e858703f-ec00-44cb-8e94-6069ad17f646,"Ullam doloremque nostrum quod. Odit explicabo ad consequuntur nobis.",2024-10-27 14:12:14,3,d0d325a1-c660-4a20-b5cd-cbef325dd834,8f247797-4c31-4918-8121-2d89cf14b2b1
2d7a36f4-4964-4dd4-a678-6f61ce2ba495,"Perferendis temporibus nostrum eos enim. Soluta tempore velit ullam ipsum dignissimos.",2021-04-12 22:02:50,1,d0d325a1-c660-4a20-b5cd-cbef325dd834,dd79c79c-b5e7-42ec-b053-bbac9381ebab
e2f709f1-ab9f-47d9-a7e4-bd22748d6cad,"Velit neque esse maiores quod neque.",2021-01-27 22:02:45,5,d0d325a1-c660-4a20-b5cd-cbef325dd834,34dd9dab-ba51-45e6-bb5d-b9448091270e
4add466c-fb18-4ba3-921a-01392a94ed8f,"Aliquid esse incidunt sunt eligendi. Quae consequatur quo deleniti. Vel facere adipisci quo.",2020-04-17 23:27:20,1,d0d325a1-c660-4a20-b5cd-cbef325dd834,c9a745c5-cff9-429d-bb1a-dea015de474c
a5ffcf42-faeb-4e8e-b926-8abc67cb92c8,"Dolores modi veritatis repellendus quod. Voluptate temporibus maxime.",2024-04-25 08:25:57,3,d0d325a1-c660-4a20-b5cd-cbef325dd834,0e2521f9-15fe-47b5-b009-909ebdfc59eb
9ad61079-ac45-4b25-9164-d1edd518d6c5,"Consectetur iure vero libero neque blanditiis aliquid. Maxime hic consectetur voluptates.",2022-01-03 00:09:04,3,d0d325a1-c660-4a20-b5cd-cbef325dd834,eaad1871-3029-4fb1-909d-740c51be40d1
ab0104ec-cdc3-4f14-84e6-ff5b79a8fa8c,"Dolorem aperiam quam officiis odio. Enim ad repellendus ipsa nam.",2024-11-07 06:15:37,5,d0d325a1-c660-4a20-b5cd-cbef325dd834,787d3e6d-495b-439b-824a-fa05e55b62c3
ba5b2160-1fb3-4be0-ad67-f957981f1c5f,"Provident architecto quam deserunt reiciendis repudiandae sint. Molestias repellat voluptatem.",2024-02-21 03:49:50,3,d0d325a1-c660-4a20-b5cd-cbef325dd834,01eb37bb-9e46-4a36-9a8e-8711b8b2b1ea
ba928e20-2785-4724-8cb2-a977b74191de,"Voluptates placeat aperiam aut dolorem quos saepe.",2020-12-30 10:09:53,1,d0d325a1-c660-4a20-b5cd-cbef325dd834,8f0a4baf-e8ae-4cd9-ab2a-375ea0a47374
d4032b3a-f59c-4c82-a357-e7cd0054558f,"Doloremque dolores nemo explicabo accusamus. Voluptas consequatur sed culpa minus enim.",2024-04-24 01:01:09,5,d0d325a1-c660-4a20-b5cd-cbef325dd834,872945b1-3575-4ee5-95d6-40c65dd69bdd
4bbe0559-9fb2-4e41-ad21-cc39eeccf8a0,"Illo explicabo suscipit quaerat. Neque qui voluptatum amet velit ad id.",2020-01-06 14:46:45,4,d0d325a1-c660-4a20-b5cd-cbef325dd834,2ee7d2d3-d242-4f2b-850c-d97850e1dbb7
2cc80625-7d61-4b48-876e-2055f4a15937,"Qui officiis nulla. Alias dolores repellendus.",2025-02-02 01:33:31,4,d0d325a1-c660-4a20-b5cd-cbef325dd834,2ca76530-5ea5-4672-8410-c9097392b3ae
31470a93-3b99-440e-b954-faf264a4bdf1,"Dignissimos quos maiores culpa accusamus. Quasi enim explicabo quas.",2022-02-01 04:31:39,2,d0d325a1-c660-4a20-b5cd-cbef325dd834,43d52bde-ff46-4e36-8094-d2379b75ffe0
c1b2685d-d5eb-4cb1-9306-9c1fce2ccb3b,"Doloribus quidem fugit id. Consequuntur omnis deleniti.",2020-10-09 10:33:47,2,d0d325a1-c660-4a20-b5cd-cbef325dd834,55aee37b-1fb1-4b17-818e-4af062f82682
54e32f2c-a7e4-466d-8ef7-87a5f008c7d3,"Sequi dolorum aliquam ratione itaque quaerat possimus. Molestiae laborum explicabo architecto.",2020-07-27 01:44:12,5,d0d325a1-c660-4a20-b5cd-cbef325dd834,c9a170cf-a170-4434-8538-bfd6b3265b60
dfda90ea-0f70-4fca-be07-4f8b5aecb08b,"Sequi labore voluptates ipsam distinctio inventore quisquam. Nisi non aliquid alias.",2022-10-07 09:09:14,2,d0d325a1-c660-4a20-b5cd-cbef325dd834,00f2de82-9c5b-40ae-b91a-3a1a9f482204
f7b823ca-42a4-4957-b40c-2e36f37d4633,"Est doloremque voluptate hic architecto. Quia nostrum animi deleniti odit corrupti placeat.",2020-12-06 20:50:27,5,d0d325a1-c660-4a20-b5cd-cbef325dd834,11cc8a74-720a-4d35-8051-396064ade2d1
d9f7e013-a545-4f47-877c-91ee6bbfd33a,"At veniam sequi perspiciatis. Ipsum provident hic qui. Ad facilis eligendi explicabo.",2022-10-02 08:10:39,2,d0d325a1-c660-4a20-b5cd-cbef325dd834,23c61a6b-6c46-4a33-8388-59ffb5f1b533
0e24e203-ea4e-48c9-a325-1b7103192db8,"Accusamus sapiente possimus. Ullam aliquam perferendis commodi perspiciatis eum.",2023-02-07 04:40:28,4,d0d325a1-c660-4a20-b5cd-cbef325dd834,d78495d9-b9da-4d18-a2bd-46a25407bd7a
2dfd4cc9-2750-4db6-a8a8-a5314ad3c2b0,"In odit et eligendi accusantium libero reprehenderit porro. Accusamus quaerat excepturi.",2020-04-19 07:59:02,5,d0d325a1-c660-4a20-b5cd-cbef325dd834,87e25470-88c0-4568-b65a-d1f22737dc34
8e728642-a6ed-4c11-b044-d52d1b5f8606,"Quaerat soluta voluptates aut possimus. Odio quas distinctio. Vitae nisi fuga ipsa hic.",2020-08-05 11:42:38,3,d0d325a1-c660-4a20-b5cd-cbef325dd834,dfc7aea5-3a58-4639-a6bc-eff41c084295
451626e3-b657-42ba-b643-c141510bbffe,"Sapiente repudiandae voluptas. Mollitia ducimus quo suscipit saepe.",2021-09-09 10:27:35,4,d0d325a1-c660-4a20-b5cd-cbef325dd834,42fb9c26-64e4-44bc-ab08-599dbef6ed9c
d5eb0989-2f49-4ef8-95df-dffc130fa345,"Delectus veniam hic vel id perferendis quibusdam. Tempora praesentium esse eligendi.",2024-06-15 10:31:58,4,d0d325a1-c660-4a20-b5cd-cbef325dd834,baaa7843-88d1-4ea8-9de4-6676b1e0d674
779ea76e-68cc-42be-a3d6-9087536361c2,"Velit corrupti beatae ullam enim adipisci ad. Ipsa nihil rerum quisquam.",2024-12-31 16:05:04,4,d0d325a1-c660-4a20-b5cd-cbef325dd834,1258ee52-7302-4890-bf4f-58d1734b4547
47361965-c7df-4d0d-af77-8d18a9c66af5,"Sed neque rem ipsam eaque neque blanditiis hic. Aspernatur odio iste necessitatibus.",2025-02-09 09:38:29,3,d0d325a1-c660-4a20-b5cd-cbef325dd834,40aa9e6d-8bfb-4281-a8b4-c4db91584fdb
601076de-95c7-4e35-becd-e4d6c80b888c,"Magnam voluptatum ea non iusto quas. Quisquam libero deserunt fugit fugit tempora quod ea.",2021-10-27 19:10:58,3,d0d325a1-c660-4a20-b5cd-cbef325dd834,1365d082-3a6d-4673-919b-dda5743e5214
7d7e9a4e-b9df-4ee6-aa4b-b496ea9958ec,"Placeat repellat nobis error laborum. Suscipit magnam in autem libero.",2020-12-15 19:08:24,2,d0d325a1-c660-4a20-b5cd-cbef325dd834,f46e602f-4a20-4c5f-862d-8afa7bcd7631
a6a8046f-e68d-4ee4-b431-9acd2d48603d,"Quo ullam exercitationem impedit. Tempore nemo qui et ipsum nulla. Quos culpa optio nulla enim.",2021-10-09 19:28:15,5,d0d325a1-c660-4a20-b5cd-cbef325dd834,2fb7ad0f-8461-47a2-b4ff-7f87e6432c63
07860e94-f22e-4f4c-b9f9-33452985f7d0,"Voluptatum eius quidem illum eos. Repudiandae soluta a fugit itaque earum.",2022-11-24 08:33:03,2,d0d325a1-c660-4a20-b5cd-cbef325dd834,22636abc-fda1-41bb-be2a-e051826e1d00
87a55667-e1e0-4790-bddc-4e8253cae5cb,"Itaque tempora quisquam ratione voluptatum dolor. Explicabo possimus non laudantium necessitatibus.",2022-05-26 07:58:42,1,d0d325a1-c660-4a20-b5cd-cbef325dd834,9ac00c17-725e-497d-b6af-8fff2fd3307c
9f6c0da6-4d3c-412f-8600-0c88a28561f1,"Rerum accusantium tempore consequatur veritatis sed.",2024-11-10 20:50:49,1,d0d325a1-c660-4a20-b5cd-cbef325dd834,58b71747-a1be-4861-8c8e-93bc81bdd049
64f92c97-b753-48da-a877-9fe6a7816627,"Aut iusto excepturi quas sit assumenda. Voluptatem sit provident. Quasi quaerat repellat.",2024-02-02 11:19:21,3,d0d325a1-c660-4a20-b5cd-cbef325dd834,64a6d8f6-48eb-449b-966c-f2c721bced96
a23327ce-151e-4631-941d-d38a16b88fca,"Molestiae illum eum dolorum harum incidunt. Ullam magni deserunt ipsum.",2020-04-02 19:27:33,2,d0d325a1-c660-4a20-b5cd-cbef325dd834,5c889647-2da8-4e02-9d52-ba234b28e32c
a44dee4b-01c4-4811-a1f2-170b43d2b39c,"Eius assumenda impedit doloribus.",2020-10-31 18:16:11,5,d0d325a1-c660-4a20-b5cd-cbef325dd834,ca798919-0a10-42ca-8474-2dc460a234c2
b7cd1d9b-65a3-4db4-8a31-ecaee4258299,"Sunt omnis culpa ratione.",2024-06-06 00:01:48,4,d0d325a1-c660-4a20-b5cd-cbef325dd834,77831eac-86c0-4417-a178-caec257f8ad7
27cb067d-55cc-47b2-b282-429e37ae4667,"Nostrum possimus nostrum deserunt beatae adipisci repellat. Incidunt asperiores vitae sit.",2020-03-09 11:40:13,1,d0d325a1-c660-4a20-b5cd-cbef325dd834,e4471b0c-ba6d-43bb-94f9-f0ff11d5bdf3
16761e28-222c-42ff-a0d0-254d9c0db705,"Enim quam fuga similique vel debitis. Harum optio doloribus saepe maxime quod harum.",2021-02-03 17:36:56,3,d0d325a1-c660-4a20-b5cd-cbef325dd834,8d9c53d7-5d79-4066-bc0a-ccd2716d6b96
210798b3-72b9-41ed-84a1-8bd5c557cd66,"Quia repellendus id quam inventore. Commodi laboriosam vitae iure dolore dolorum nulla.",2025-01-23 13:40:36,2,d0d325a1-c660-4a20-b5cd-cbef325dd834,6c6e4f0e-75ea-483f-8516-43523c61f336
e5703a64-13d7-4fd7-b3a6-93fded0c9378,"Iusto autem dolores adipisci assumenda rem. Beatae magni neque similique aut optio maxime deleniti.",2021-01-01 04:07:29,2,d0d325a1-c660-4a20-b5cd-cbef325dd834,0c53925a-54f2-4b8f-a364-945414468e0c
648b6f1f-6787-4344-a288-4258f84f7d55,"Dolorem ab omnis ea perspiciatis. Sint rem optio magni earum.",2021-08-22 09:01:56,3,d0d325a1-c660-4a20-b5cd-cbef325dd834,3881f91c-edb7-4659-884e-354e85f7bd5e
