review_id,review_comment,review_create_date_time,review_overall_classification,review_user_id,review_wifi_spot_id
890ae644-9fb9-4888-92c1-80385dfa4a0c,"Nesciunt minus aspernatur. Officia earum eaque eaque impedit.",2022-12-22 03:59:35,4,d0d325a1-c660-4a20-b5cd-cbef325dd834,f534d598-a462-4e75-b1d4-e2c46f64c2fc
2343a019-d7ff-4688-87ce-4781bc92d6d2,"Aut sed excepturi id sit.",2023-09-01 14:34:56,3,d0d325a1-c660-4a20-b5cd-cbef325dd834,32050e32-85e7-4a06-a5a8-9ff11bf9b2dd
c162b00a-73eb-4a57-a3e5-c553fb4285cc,"Exercitationem hic neque velit fugiat vero. Labore qui non soluta suscipit. Ex tempore veniam quis.",2020-04-15 01:43:05,4,d0d325a1-c660-4a20-b5cd-cbef325dd834,26cf8d5a-da9d-4682-a200-280d65f8dc69
d8490819-9615-44c5-a3c7-74a95e1d52e0,"Porro repellat ut sapiente repellendus. Ad occaecati facere sint.",2022-07-07 23:11:35,3,d0d325a1-c660-4a20-b5cd-cbef325dd834,9f9a3518-e3fd-46d1-8b2d-3ee079f3883c
679fecd4-054e-4035-b25d-a54b05f1fab2,"Iste quia hic iste ullam iste nobis. Ullam recusandae asperiores deleniti dolor corporis.",2020-07-31 10:07:00,2,d0d325a1-c660-4a20-b5cd-cbef325dd834,792bc36c-b901-4886-8d41-ad7caa786162
45701aa2-1f2c-4478-92a5-ffa3e9e1d4c3,"Itaque sint inventore asperiores. Omnis similique neque.",2023-05-04 19:16:29,3,d0d325a1-c660-4a20-b5cd-cbef325dd834,9acc417a-a659-4fd6-be6c-e6a5a95f7b2c
b56b8ac8-0ef9-4e63-89f5-825ea38eaf9d,"Amet sint laudantium molestiae. Quas mollitia recusandae rem repudiandae.",2020-07-14 12:48:24,1,d0d325a1-c660-4a20-b5cd-cbef325dd834,d6f080a4-4693-4a54-bcae-f9af3d48210a
affea73e-de5c-4ee9-bea4-ce2ef4c3faf9,"Impedit rem veniam voluptatem. Neque expedita voluptates. Atque culpa quos quo.",2025-01-04 12:22:54,2,d0d325a1-c660-4a20-b5cd-cbef325dd834,1e112eb6-c9eb-4008-9936-ae59b7a59252
730e0113-b1a7-4a81-9c98-65d72370d531,"Non velit alias impedit soluta ab cum odio. Ullam in maxime eos modi recusandae.",2021-07-25 00:46:13,4,d0d325a1-c660-4a20-b5cd-cbef325dd834,61fd3b75-3849-4273-baa5-96ec51e44ff8
b5ec713a-aa0f-4265-a6ad-c13f25fec318,"Autem labore illo minima. Ullam ab voluptas repellat quidem. Nesciunt unde dignissimos atque.",2023-06-12 01:08:53,1,d0d325a1-c660-4a20-b5cd-cbef325dd834,8dbbbbd7-25e8-4642-95e1-5216cb5ad050
d3dc8539-995a-43bc-8e5e-dfb07bd21aff,"Temporibus odit rerum.",2024-03-11 09:42:02,3,d0d325a1-c660-4a20-b5cd-cbef325dd834,c2fb5c28-767a-4390-9967-0f3b27de0104
00fb4b2b-2e9f-4b0e-ae13-34107568e818,"Eum quam nemo temporibus temporibus sint. Deleniti nisi eaque quae ex.",2022-08-30 23:33:23,3,d0d325a1-c660-4a20-b5cd-cbef325dd834,319075ab-39c7-4368-b96f-7ff19359122e
cefe7422-1422-4bcf-8df2-b1cc86ce65fc,"Ipsa similique magnam praesentium unde. Voluptatem quibusdam voluptatibus quia tempore.",2021-06-25 13:43:13,3,d0d325a1-c660-4a20-b5cd-cbef325dd834,5be21121-e369-4f5b-8858-5fef438457ca
7f936868-18d8-4261-ad95-661b208f698d,"Consectetur assumenda ex sequi odio deserunt rem. Corporis voluptates accusantium dolor facilis.",2023-08-04 00:11:15,3,d0d325a1-c660-4a20-b5cd-cbef325dd834,26b3cbeb-fd51-4a2c-929e-d5b6a4df6c7a
4cee99fc-2675-4fb0-826e-d3ffd408ba50,"Architecto nobis explicabo repellendus magnam nisi eaque. Id distinctio non consequuntur totam.",2024-07-21 05:32:17,4,d0d325a1-c660-4a20-b5cd-cbef325dd834,59e16685-2b96-40c4-80aa-e7925e66d7ce
2f17462c-bca9-4710-a396-c858ed0f5660,"Est fugit velit. Quos nisi nesciunt aut non dolores provident est.",2021-01-22 16:22:34,2,d0d325a1-c660-4a20-b5cd-cbef325dd834,06622e7b-a318-4e15-bc27-0aa23f333e08
067f62a0-7c94-4b12-8f4d-c7e09957774a,"Eaque eum debitis adipisci est fuga molestiae. Vero assumenda officia distinctio.",2022-01-06 21:31:59,1,d0d325a1-c660-4a20-b5cd-cbef325dd834,d4898056-08ee-421c-b752-71fd25759772
62ad804f-24ca-4fc2-9278-701d40f8e9be,"Eos perspiciatis corporis excepturi.",2020-11-18 09:44:31,5,d0d325a1-c660-4a20-b5cd-cbef325dd834,97bfbc39-a126-4bd5-bf91-6e5a05e8fc6d
b80df791-e7e7-42e0-a80a-5aa9b35aac74,"Architecto esse blanditiis debitis doloremque ea quibusdam. Tenetur nam cum illo.",2023-07-16 05:05:13,4,d0d325a1-c660-4a20-b5cd-cbef325dd834,3b2e6a91-30c2-4d73-b62a-2425a85cc67f
4b53015e-7e1a-43b7-98f8-5f73fffcca23,"Fuga laudantium omnis voluptates dolores. Magnam incidunt cumque provident.",2021-11-22 00:09:50,4,d0d325a1-c660-4a20-b5cd-cbef325dd834,80971ae4-95bb-40f3-9a7a-5b63b7a92792
8b7737f4-e659-4160-888c-1e51dabc56b6,"Totam sit incidunt accusantium quisquam ratione. Ea at ipsam dicta ab.",2020-06-15 19:42:31,1,d0d325a1-c660-4a20-b5cd-cbef325dd834,42834320-cc76-45fa-99b2-cd4134410560
c3233814-d4e1-4436-bf7c-b252eccd2899,"Error possimus sed soluta dicta quas natus.",2022-02-19 07:54:24,5,d0d325a1-c660-4a20-b5cd-cbef325dd834,995ffbcb-7b93-48ea-a110-2cad47d2f9d8
4d41de31-b6d8-4d7d-b04d-038214de1550,"Dolores beatae mollitia at consequatur quidem alias. Fugit quos vero facere.",2021-12-06 00:00:08,4,d0d325a1-c660-4a20-b5cd-cbef325dd834,9bfaa5d9-f9c9-48a6-9ee8-1536d5fc9188
976c2dec-14ae-4854-87d3-503ecc03210f,"Necessitatibus iusto nemo rem consequuntur earum rerum quaerat. Quasi ipsa odit quas.",2021-06-18 14:40:46,5,d0d325a1-c660-4a20-b5cd-cbef325dd834,06b93188-b008-4d12-b23a-b946257538a4
af908530-dee1-4e34-9e40-eeb2b47f58df,"Itaque voluptatem doloremque architecto odit.",2023-11-05 18:39:25,2,d0d325a1-c660-4a20-b5cd-cbef325dd834,fb19ea2d-45f7-4a09-bc59-1b441a0abd19
69f9dc1a-6e28-40f8-9860-53a49b175022,"Aliquam fuga quam iste. Numquam sed eveniet voluptate fugit cum tenetur.",2025-04-13 10:08:25,1,d0d325a1-c660-4a20-b5cd-cbef325dd834,d0a49e32-3438-49e8-b16e-fcefec554d29
902f00c8-8929-4496-870b-bdbca2ab6fb8,"Iste illum qui a. Voluptatem fugit ipsum dolor laborum eligendi reiciendis eos.",2024-11-22 16:08:37,1,d0d325a1-c660-4a20-b5cd-cbef325dd834,b6fc1c88-3448-4ac5-8d8f-2602976206af
3a190961-7104-4dd0-8652-4c1b6b579844,"Dicta doloremque recusandae tenetur.",2020-01-08 10:07:05,4,d0d325a1-c660-4a20-b5cd-cbef325dd834,9c43d516-8754-4a60-a46b-cf4450c09f6e
c6756c14-ab4f-4165-871e-5c482bbef27c,"Nostrum dolorum ad sit impedit animi minima. Nam quo sapiente quaerat.",2023-05-02 00:54:28,3,d0d325a1-c660-4a20-b5cd-cbef325dd834,a14fb2e6-b2ca-4180-bcf7-b1baec9f2e8a
a135520d-f0fd-4626-86a0-8d00cc41bbed,"Eum nemo exercitationem minus error ab. Similique sunt doloremque consectetur rem iure eaque.",2024-10-18 21:03:22,2,d0d325a1-c660-4a20-b5cd-cbef325dd834,8d0fd5b6-b311-4114-9562-07562bf01e35
8a057cdd-d823-4daa-86ed-cee143fd5292,"Blanditiis natus quos eveniet. Voluptas totam harum magnam nihil officiis.",2024-07-23 10:28:33,2,d0d325a1-c660-4a20-b5cd-cbef325dd834,97ec95ce-a74b-49b0-a052-12b36bf50ab9
355368da-d11d-4809-a8f7-2e194826d513,"Aspernatur doloremque ipsam. Voluptas repellendus architecto quasi minus laborum.",2023-06-06 04:10:47,2,d0d325a1-c660-4a20-b5cd-cbef325dd834,46987f42-432f-4976-a3f1-05f444227abe
d24e2de4-75dd-466a-b256-48ce5c0ba3b9,"Consequuntur quos non delectus beatae. Facilis recusandae ut eius. Sunt fuga nesciunt.",2023-02-16 03:20:59,5,d0d325a1-c660-4a20-b5cd-cbef325dd834,565af3c1-68f3-409c-a0f5-0952ba99260a
b76ed047-4a87-48eb-86b9-b78cf614482d,"Unde ut officia at distinctio. Nemo tempore nulla.",2022-01-11 08:40:10,5,d0d325a1-c660-4a20-b5cd-cbef325dd834,37d7937e-b7ea-4fa0-8272-e54a7fa3be47
42abd75e-8c66-4adf-a0d0-a87a567d5765,"Fugiat temporibus commodi similique dolores. Ducimus autem dolores delectus ullam deserunt.",2025-04-03 13:07:22,2,d0d325a1-c660-4a20-b5cd-cbef325dd834,5e1655fa-bdb8-4125-be4f-cef3f92a32bc
f187f685-80d4-4ead-a054-406484b9e7c5,"Eius ipsum harum rerum illo voluptatum accusantium. Doloribus iusto quas earum quisquam eveniet.",2020-06-23 21:05:58,1,d0d325a1-c660-4a20-b5cd-cbef325dd834,97cb3aab-eec5-4414-9067-ab9069457020
6021ed54-c482-4d9d-8c7a-d8f1a3d08c92,"Nesciunt accusamus sit. A ipsam accusantium cum perferendis occaecati esse.",2022-11-13 08:41:25,5,d0d325a1-c660-4a20-b5cd-cbef325dd834,68da447c-7532-4262-aa1c-169f554f7b34
f163e05e-4667-4a36-9012-d2a4cfd28d88,"Dicta harum molestiae. Quam minus in aspernatur.",2024-06-16 16:51:21,5,d0d325a1-c660-4a20-b5cd-cbef325dd834,0babc4ef-55c6-43bb-9f6a-0458e272ddce
236cb5f9-4526-4f5f-8e3c-3619b5212d63,"Repellat ducimus perferendis ea praesentium enim delectus. Fugiat quas quibusdam.",2023-04-25 16:20:02,4,d0d325a1-c660-4a20-b5cd-cbef325dd834,d87b9939-e1cf-4396-9520-5eab0be1052a
b23a6784-4c4c-4676-85c7-1c93a7ec02be,"Provident aliquam quam. Commodi officiis quasi repudiandae. Maxime perspiciatis neque deserunt.",2023-11-23 09:43:31,3,d0d325a1-c660-4a20-b5cd-cbef325dd834,7d841cf0-b0bc-46bd-a7bc-3da800c01f44
7a2bb4e2-6543-458c-bb5a-d8679bb0b326,"Consequuntur ullam minus cumque necessitatibus. Minima nemo numquam ipsum.",2025-01-14 00:35:08,3,d0d325a1-c660-4a20-b5cd-cbef325dd834,f4dab464-a1d3-4ec0-83dc-c6bb4c9004bd
06eb5fa9-673b-407a-ac82-943fae4bcf69,"Velit minima magni distinctio. Iure error ratione vero.",2025-03-06 16:33:47,3,d0d325a1-c660-4a20-b5cd-cbef325dd834,fc68528d-4585-4af7-b6a6-e07c52dbaf78
0057f5b2-426e-4bca-9d80-3c8d95142064,"Beatae atque velit nesciunt totam. Excepturi aliquid totam nihil similique architecto asperiores.",2020-02-14 18:56:09,1,d0d325a1-c660-4a20-b5cd-cbef325dd834,3d9eab29-1f40-4780-9d88-374fdb0894a3
12bbfb1c-1511-40cd-b8e2-e406b0d81f48,"Consequatur distinctio similique repellat. At vitae dolores impedit. Qui ad rerum.",2021-08-04 14:29:07,2,d0d325a1-c660-4a20-b5cd-cbef325dd834,53a182f0-8d52-4f6b-bc93-d92a01823ad4
f8a75bff-9ad5-4574-bf55-2d380ac87262,"Ex eum natus doloremque impedit laudantium. Ex modi suscipit voluptatum est nobis tempore porro.",2023-06-18 22:50:46,4,d0d325a1-c660-4a20-b5cd-cbef325dd834,7615cbfd-2321-4826-8622-fbacab36dbd5
6a018ba2-7dc1-40d5-873b-47b5425f580d,"Dolore fugit quae earum accusamus sunt repellendus repellat. Fuga repudiandae animi eveniet.",2021-05-27 11:29:11,3,d0d325a1-c660-4a20-b5cd-cbef325dd834,a73e65da-b975-4461-b8f8-90f8ac5870de
57bffae8-aca7-4c25-9097-fd2239fad064,"Voluptates atque corporis eaque eos officiis saepe. Ipsum exercitationem quaerat.",2025-04-18 07:34:18,3,d0d325a1-c660-4a20-b5cd-cbef325dd834,70616f41-e26c-4e7d-b190-3ff502574c3a
d915c659-e710-4e6a-9b17-4ee1e8927801,"Natus ipsam nesciunt non ea. Illum molestiae recusandae eveniet. A expedita magni ipsa.",2020-08-28 11:52:37,3,d0d325a1-c660-4a20-b5cd-cbef325dd834,d3eda87e-4bcf-4f64-8d24-4a575dd1c893
2532871a-be0a-49ae-9de9-ba9bdcfa39fc,"Quibusdam magni facilis quibusdam. Deserunt blanditiis architecto quas.",2024-04-29 08:13:20,3,d0d325a1-c660-4a20-b5cd-cbef325dd834,31369b1d-18ff-4a48-a0ce-173ad6cdca03
37b49b48-5e70-4429-95ae-3cc349021ca8,"Iusto illo tempora quas accusantium itaque quaerat. Recusandae architecto fuga quam est.",2022-05-06 10:23:02,1,d0d325a1-c660-4a20-b5cd-cbef325dd834,4de80bc4-f286-4aae-be50-99cbf2efbca8
7333058a-f243-43b5-a734-d81122b4e4c8,"Tenetur sunt quod nesciunt unde dicta. Sunt accusamus officiis ea ratione molestiae.",2020-12-26 23:13:48,2,d0d325a1-c660-4a20-b5cd-cbef325dd834,8076d1b6-1348-4036-8b7c-162f021f8c50
5a6f1531-f49d-4945-b7b9-fe0ee5e900ef,"Aliquid ex consequuntur enim culpa. Iure dicta inventore sequi.",2023-08-31 01:50:29,4,d0d325a1-c660-4a20-b5cd-cbef325dd834,34b36bb6-8fd1-41b9-80e8-2e461cfc8e78
33d1ca3a-c1cc-4c82-a876-4e363c5a0fcf,"Suscipit ut asperiores omnis nihil.",2021-01-01 14:30:54,4,d0d325a1-c660-4a20-b5cd-cbef325dd834,73c9486d-c763-4a34-bf24-b50bc23d341f
da4e5d47-4cb8-44c3-bdce-731bbf7b0829,"Fugit est molestiae praesentium quaerat praesentium.",2023-07-19 02:52:05,4,d0d325a1-c660-4a20-b5cd-cbef325dd834,adeb280f-79d6-41c1-9957-ebba47f6d2d9
43721fd6-683b-42cf-8224-5e0308d62a34,"Necessitatibus sunt facilis ratione eum occaecati fugit. Ex inventore illo accusamus quia.",2025-02-12 08:05:05,2,d0d325a1-c660-4a20-b5cd-cbef325dd834,1083e34f-dba3-4fe5-9e89-03e8015854ad
c715cfd5-64b7-4ee4-8773-d057762cd183,"Voluptates odit ad rem. Distinctio sint blanditiis molestias aut.",2020-02-25 07:04:04,2,d0d325a1-c660-4a20-b5cd-cbef325dd834,41113245-f685-457d-8acf-1068fd73d5d2
575c3b9e-bed0-4b42-b8d9-9b7568b1f39f,"Quidem quam dolores. Voluptate temporibus iusto consequatur doloribus.",2022-06-15 22:45:42,2,d0d325a1-c660-4a20-b5cd-cbef325dd834,fe6517c7-fc21-44cf-9a23-421ec21f7bcd
6152bf32-f487-4b2e-9e1b-333921ebe923,"Aliquid enim quibusdam facilis. Esse aut cumque a dolorem labore dolorum.",2023-06-21 22:01:22,5,d0d325a1-c660-4a20-b5cd-cbef325dd834,6a213f57-81e9-481c-bdac-afe09be5b918
f2b2ddf7-e363-45af-a3b5-271e2de581b1,"Accusamus doloribus at laboriosam nam magnam. Aspernatur optio repellendus recusandae dolores.",2020-11-07 18:32:36,3,d0d325a1-c660-4a20-b5cd-cbef325dd834,3824b838-35b3-410f-81f6-729d163d44d7
7a5c0cc8-26f9-4bcd-9f8d-2da0c3e7bb8a,"Natus consequatur reiciendis reprehenderit. Voluptas optio quisquam dolore quod.",2021-01-06 09:12:01,5,d0d325a1-c660-4a20-b5cd-cbef325dd834,177566cf-43c5-4688-b882-6987ea3ff4b3
3d9ff4aa-0715-428f-9aca-b678d3d729f7,"Soluta laboriosam sapiente. Optio ratione ab tenetur ea.",2022-01-12 20:39:02,1,d0d325a1-c660-4a20-b5cd-cbef325dd834,a957ece8-4675-48e4-8c3d-5dc308ed265b
ea842123-fdad-4cf6-ba49-c2aef0632285,"Blanditiis illum ducimus dignissimos fuga.",2024-08-23 01:19:50,5,d0d325a1-c660-4a20-b5cd-cbef325dd834,4150b550-c0d3-4e7f-839f-3ac55f43bcbd
02bd43be-d5a6-4358-9ad3-91b5679fea87,"Expedita laborum molestiae quisquam molestias porro officiis est. Doloribus velit laboriosam.",2021-08-15 12:16:10,4,d0d325a1-c660-4a20-b5cd-cbef325dd834,7d4116ef-cc1c-463a-a4e0-115af11e35d3
598112bd-434b-463f-b788-ca56d35b2e9d,"At voluptatum reprehenderit est aperiam nam.",2024-03-21 13:06:22,3,d0d325a1-c660-4a20-b5cd-cbef325dd834,538fa93f-2179-460c-a573-8ce609274371
ff4371a9-289b-4fbe-b62e-de09d0791d15,"Accusamus magnam asperiores debitis porro aspernatur. Ab quos ad officia rem perferendis.",2024-11-21 20:51:56,1,d0d325a1-c660-4a20-b5cd-cbef325dd834,84bacc3a-d7d0-42ad-ac14-ff26917501b2
98eacc18-8c82-446e-bcde-d71833cc3645,"Sequi ad sequi fuga. Temporibus illum dolore sint eum dolor. Aspernatur at ducimus mollitia.",2021-09-13 01:58:11,3,d0d325a1-c660-4a20-b5cd-cbef325dd834,16b810d0-a26b-493f-936f-ad8e17118908
fcd72c85-d636-4bdb-b36a-9654925aa454,"Quae odit eius. Rem laborum ad id ea nisi qui maxime.",2024-10-06 23:53:06,5,d0d325a1-c660-4a20-b5cd-cbef325dd834,c6c939ba-4863-45ef-9e55-5fbd9160e64a
55c00a53-93fe-45c6-bc69-38d7c0e60151,"Odio voluptate aut corporis vero minima blanditiis. A non sequi similique consequatur quia vero in.",2024-03-14 07:04:02,5,d0d325a1-c660-4a20-b5cd-cbef325dd834,98175761-40f1-4173-a3dd-ab92119a3a0c
83c51135-fe08-4b58-a4e4-1ac6e474770d,"Labore accusamus fugiat nisi dolor inventore. Aperiam assumenda fugit numquam.",2023-06-06 12:09:28,4,d0d325a1-c660-4a20-b5cd-cbef325dd834,c1c828b8-bcd7-40dd-b04a-5871b3d9896f
0a9f8cc1-9667-4022-b82c-30f50d0caa4a,"Quo magnam exercitationem aspernatur illo vitae.",2020-04-20 02:01:18,1,d0d325a1-c660-4a20-b5cd-cbef325dd834,c1f2b456-14fe-44d2-9f67-e6824092cd09
3dd54f85-ad7e-4055-baab-22479f23d6ad,"Commodi ipsum nisi illo libero architecto. Maiores provident eaque repellat iste.",2021-08-21 04:02:25,5,d0d325a1-c660-4a20-b5cd-cbef325dd834,b4a65d75-5d35-4dac-9025-27858b960d5b
f5330efe-b285-4d46-8089-e74391cd9450,"Sit earum ipsum sint deleniti. Quam vel sint eaque quam fugit.",2025-01-03 19:39:59,1,d0d325a1-c660-4a20-b5cd-cbef325dd834,150e3c24-e024-4705-af6c-d4bf0994cfbe
a9ca414d-3ccb-42d9-a71a-92b0f7b2ace3,"Impedit voluptates aut unde error. Aliquam veritatis aspernatur totam. Molestiae ipsum pariatur.",2022-02-09 13:25:01,5,d0d325a1-c660-4a20-b5cd-cbef325dd834,34bfc1dc-5631-4da6-be80-7f65af63cfc0
4b191f34-8284-4895-b6c9-d6b6d24bb873,"Distinctio voluptatibus unde nisi quos. Consequatur iste neque aut ab explicabo.",2020-07-18 18:31:19,2,d0d325a1-c660-4a20-b5cd-cbef325dd834,b3cb5230-461a-4362-ba78-4f8e29d15e28
be0a7a6a-b483-4dc3-a06d-a4afd663c11b,"Excepturi quos iure. Assumenda architecto illum.",2024-05-29 11:17:09,4,d0d325a1-c660-4a20-b5cd-cbef325dd834,2cad1980-5534-48f3-981a-36ad3bf44f89
d94e0f5c-f108-49b3-a183-cb7e1ce0fa0b,"Sint quas placeat culpa. Occaecati iste nemo error illum nulla magni. Sapiente sunt labore tempora.",2021-03-02 01:43:35,2,d0d325a1-c660-4a20-b5cd-cbef325dd834,0d22adc6-4fbb-4812-9a9a-07e857f7fdd3
cb95c82e-c855-4156-a1d2-73f2a8e7f220,"Harum atque quo.",2023-07-07 20:09:17,1,d0d325a1-c660-4a20-b5cd-cbef325dd834,6b7e9011-370f-42fa-b539-2630a55702c9
1710c1e2-40db-4220-9eae-a19d542a7791,"Impedit fugit qui.",2023-08-20 07:09:30,4,d0d325a1-c660-4a20-b5cd-cbef325dd834,78efb77b-7427-443d-abeb-b40d24b46010
29b6d6b5-45c9-437a-910b-71bd59c08db6,"Natus facere nesciunt. Odio reiciendis ea praesentium placeat id officiis. Autem aliquid ea.",2020-09-18 12:43:17,2,d0d325a1-c660-4a20-b5cd-cbef325dd834,57b28f63-be5c-4e17-ba13-6b2b45a33a6d
de06e335-3fd9-4d54-b164-fd0bdb52281b,"Eos quisquam nulla est. Sit autem autem vero.",2025-01-26 03:59:58,3,d0d325a1-c660-4a20-b5cd-cbef325dd834,b6619da7-467e-4aa8-a198-7e3842c9d9dd
bd408df6-51d4-4c11-9537-bf58cf5bca19,"Reprehenderit autem provident aliquid impedit. Officia similique vitae consectetur harum.",2021-09-16 05:22:16,3,d0d325a1-c660-4a20-b5cd-cbef325dd834,222a8ff4-e1f9-45d6-a0b0-a060a3e89a4f
2dc53734-c389-4f41-b76f-0c50e023f376,"Fugit eaque est aperiam explicabo corporis at dolor. Nobis quos eum eum atque et beatae.",2020-05-05 08:49:26,1,d0d325a1-c660-4a20-b5cd-cbef325dd834,bcb5ae92-0c23-4fab-9621-eaebea4bccda
86d83773-095a-42ca-91e6-8c9e2d11ccc6,"Sunt iusto similique impedit delectus numquam soluta. Quam ipsa dicta neque cumque fuga quos.",2022-04-04 17:15:48,4,d0d325a1-c660-4a20-b5cd-cbef325dd834,ee6d56c2-20eb-4f79-b9ac-221318a4e9ee
f25fdb15-0008-495b-9d24-a7a3168f2428,"Temporibus fuga nobis dolore. Quisquam nisi tempore cum. Quas cumque ad.",2021-04-07 11:58:48,2,d0d325a1-c660-4a20-b5cd-cbef325dd834,b5934b0d-6420-4362-bfec-6f8ba37e3f9d
9c51eac0-9df9-4b0f-9068-1fcabffe8812,"Facilis pariatur ea incidunt. Placeat aliquam quod. Dolore velit dolor tempora laborum.",2021-12-04 11:56:30,4,d0d325a1-c660-4a20-b5cd-cbef325dd834,6d568003-0bcf-4971-a063-167f2bd158da
8ec85f5b-afed-493a-950a-36a1c7a4d892,"Iste repellat cum veritatis amet quidem culpa esse. Optio enim porro eaque recusandae.",2024-12-09 12:55:29,5,d0d325a1-c660-4a20-b5cd-cbef325dd834,71d1e5ca-989b-4364-840a-496cf1aa8f85
3339d657-bf7e-40b7-b029-e97a70b5925f,"Cupiditate excepturi aut tempora. Assumenda voluptate vero rem mollitia.",2024-06-04 17:28:28,3,d0d325a1-c660-4a20-b5cd-cbef325dd834,e32a1852-b14b-4e59-ba3b-400a3bed3007
2751756a-997a-4312-a428-c5b580cf1a56,"Illum molestiae molestiae cupiditate. Eius distinctio minima officiis.",2020-05-21 15:56:43,2,d0d325a1-c660-4a20-b5cd-cbef325dd834,31e1ee52-1547-4611-ad7d-9b998670d4de
0dc4732c-eeba-410a-a7cf-a76e8598d2c0,"Iusto unde tempora ad.",2023-09-07 18:26:05,3,d0d325a1-c660-4a20-b5cd-cbef325dd834,abdb8175-9a81-4882-9637-c67da24d7922
6b43ee28-aa9e-481f-a358-0bc05e4ffc3f,"Fuga ab qui. Voluptatibus fuga ipsum cumque deleniti quis.",2023-07-06 03:35:06,3,d0d325a1-c660-4a20-b5cd-cbef325dd834,901168ee-5e47-4960-bab9-8a0adf8dbac7
f6f92894-7057-429e-a708-cdc32d981247,"Illum sunt reiciendis fuga iure beatae quia.",2022-02-27 07:52:13,5,d0d325a1-c660-4a20-b5cd-cbef325dd834,6dbb3cf7-3b81-4689-8669-4df1cb04177e
b240a335-1e3b-4371-87c3-683dbaed818a,"Voluptatum occaecati earum fuga aspernatur modi. Commodi corporis nisi voluptates tempora.",2022-05-22 01:57:38,4,d0d325a1-c660-4a20-b5cd-cbef325dd834,44acd671-c21c-441e-b45a-b65d8f073af6
31d61aee-91fb-4abf-a933-c9569792c64f,"Saepe nisi temporibus aut. Quaerat magnam fugiat facilis. Doloribus similique dolor tenetur.",2024-01-19 12:54:06,3,d0d325a1-c660-4a20-b5cd-cbef325dd834,83c55c00-29e5-4d62-af5c-4a7ee85b61c0
408d0cef-45f2-4e46-89eb-eac5915bf3b6,"Neque debitis ipsam sed assumenda amet aliquid. Veritatis nesciunt doloremque eaque deserunt.",2021-10-15 22:21:12,4,d0d325a1-c660-4a20-b5cd-cbef325dd834,55fca665-43e6-4324-9ad5-bd028d3a4ea3
47477c7c-e9d9-40d5-97df-c6800c39f022,"Quos eos quaerat. Eveniet dicta sunt dignissimos laudantium quia.",2020-01-21 12:06:56,3,d0d325a1-c660-4a20-b5cd-cbef325dd834,2efee2f7-779c-4606-8363-221895591e84
b9240428-25b4-493b-be5c-94d2f35afd35,"Deserunt pariatur totam blanditiis repellat mollitia. Aliquam asperiores numquam unde.",2020-10-09 23:21:25,5,d0d325a1-c660-4a20-b5cd-cbef325dd834,029d8a56-f0b9-4536-b4ae-8912e46047c3
8b3b4229-0cd9-4959-850e-a504134124d6,"Saepe nihil doloribus. Ullam sequi in doloremque necessitatibus. Sint quaerat est praesentium.",2024-02-26 17:00:12,2,d0d325a1-c660-4a20-b5cd-cbef325dd834,87125b6a-196c-4604-8498-c9fbc754d62a
b4b29b20-08ad-4454-a024-2ba80431fa99,"In non totam quia molestiae nobis. Soluta eius quasi reiciendis ut illo provident.",2024-02-05 21:50:59,1,d0d325a1-c660-4a20-b5cd-cbef325dd834,01848bcd-c7a0-4806-9eb9-97547f16b425
4453fd99-a74e-40fc-a61e-64a7c006d228,"Amet ratione impedit maxime. Beatae aliquid facilis officiis quos.",2020-02-20 18:23:03,1,d0d325a1-c660-4a20-b5cd-cbef325dd834,71bd2508-fc0c-44a1-932b-c0c9f65ed46a
041bcde4-989f-45d0-b287-4aaf8fe356d2,"Ab quasi deserunt ipsam illum saepe ipsam. Numquam at eum veritatis dolorem.",2024-01-05 10:37:13,2,d0d325a1-c660-4a20-b5cd-cbef325dd834,7c462420-754f-4e81-a9f0-3bdf087ca63f
d1113dc5-4fd6-4f3b-a975-6eeeffa4ec7a,"Repudiandae inventore vel modi. Repudiandae deserunt quidem molestiae odio iste.",2020-04-21 15:30:28,4,d0d325a1-c660-4a20-b5cd-cbef325dd834,f7bfc1bb-358f-4738-a07a-8a586571bc53
1a74531b-aeb4-4313-872f-4af24a4e77d8,"Sed sequi neque ut facilis porro. Occaecati unde quidem.",2022-11-29 17:45:22,1,d0d325a1-c660-4a20-b5cd-cbef325dd834,50cdfa72-90d4-40ab-9cdc-aa5e114bc1b8
b78dec63-f032-458d-a71c-cc80b7ae087d,"Ad accusamus similique quo nesciunt libero. Dicta id odit. Optio distinctio fugit assumenda.",2024-11-20 05:33:53,1,d0d325a1-c660-4a20-b5cd-cbef325dd834,5be19bc8-05b3-4657-83e1-7015b54e5d80
003c1303-b0fe-4ee6-9cd1-af20a4faac02,"Culpa adipisci necessitatibus doloremque alias ipsam.",2020-03-24 00:46:39,5,d0d325a1-c660-4a20-b5cd-cbef325dd834,f6816e01-7cf2-46c8-9965-73a6c3b44a96
a56a00b4-4d3a-4689-8069-1b96b5de2966,"Nemo eligendi ex modi quibusdam id nihil. Hic dolore enim unde.",2021-06-13 16:41:25,2,d0d325a1-c660-4a20-b5cd-cbef325dd834,ce6651e0-86a5-4988-ae48-4ddf02818a59
c685a06f-6801-4121-85c7-82dfac577cd6,"Animi doloribus facere optio nihil at pariatur. A neque fugit nostrum beatae veritatis.",2021-08-25 01:04:04,5,d0d325a1-c660-4a20-b5cd-cbef325dd834,39776690-ccb2-459c-b4e8-e91821e0a74e
5c97a2b6-7dec-4dff-8538-8e3d9385dbac,"Voluptate iure quis. Architecto exercitationem sequi nisi adipisci laborum architecto.",2021-05-09 12:28:20,1,d0d325a1-c660-4a20-b5cd-cbef325dd834,aba2c302-a8dc-4578-8315-42ea1336d602
6301b2f4-21c1-4c94-a6b4-e6f14b4a46f0,"Iusto eaque provident reprehenderit maxime.",2024-02-19 03:47:31,1,d0d325a1-c660-4a20-b5cd-cbef325dd834,8fde640c-53d8-45aa-83e6-abe581fa03bb
7b910ebf-3c6d-469e-b023-cdb8ff883e64,"Quis eos quod aliquam necessitatibus atque exercitationem illo.",2023-06-12 06:12:00,5,d0d325a1-c660-4a20-b5cd-cbef325dd834,85c98748-6b0f-4a4c-9015-e685d2936b53
58a3f0b9-e061-4f6f-85ad-e1270be4061b,"Quasi debitis ad quos debitis. Optio excepturi maiores quis.",2021-12-05 17:57:00,5,d0d325a1-c660-4a20-b5cd-cbef325dd834,054bd74e-6972-4cff-a812-b9ad2ba8a497
fe9c47af-425c-406b-864b-803deafb990d,"Corporis soluta iste. Ea quidem esse at. Temporibus qui rerum veritatis cumque ipsa corporis harum.",2023-02-19 10:22:37,5,d0d325a1-c660-4a20-b5cd-cbef325dd834,bdcc2bad-d2a1-4905-81af-70fe00c00f6a
a20559b6-fd00-405f-ade4-9509bec97b6f,"Maiores in quam.",2020-05-03 09:08:46,2,d0d325a1-c660-4a20-b5cd-cbef325dd834,c5ee1cd4-830a-4314-894c-9df35d1b9f1a
0a4fb0b4-5db7-49d3-b46c-624f1bba4828,"Rerum quasi ex possimus hic dolor. Est sed recusandae deserunt veniam.",2020-06-14 00:06:36,3,d0d325a1-c660-4a20-b5cd-cbef325dd834,30c5e957-fae4-482f-9fc6-d10fbe978937
2e07c992-7220-44f5-8a06-5315405d9ce2,"Minima officia deserunt dolor veniam quisquam cupiditate. Id dolorum ipsum sint odit labore a.",2023-07-23 14:05:20,4,d0d325a1-c660-4a20-b5cd-cbef325dd834,d0a25415-9cf5-46d0-9a17-7d0997d2a502
8fa547be-42f7-4c85-aca7-fec0298cd04e,"Quia eius aspernatur vitae odit iusto repudiandae. Dolorum amet maiores laboriosam.",2024-06-12 08:21:01,2,d0d325a1-c660-4a20-b5cd-cbef325dd834,5fe41fc5-cf3b-4871-b9f2-99c4f9da3fbf
5ab0cc87-7136-434e-a477-fc6785333429,"Reiciendis ab amet. Tempore vitae possimus non provident tempora itaque.",2020-12-19 01:35:54,1,d0d325a1-c660-4a20-b5cd-cbef325dd834,33383e94-9eeb-4a20-b29f-6eed09741808
b99be289-ce3b-4306-b365-2b8141f05235,"Commodi nulla porro.",2024-01-25 14:34:08,1,d0d325a1-c660-4a20-b5cd-cbef325dd834,38fe1d66-611d-4f17-89d1-97f20f0a1d87
e83d19c8-f457-4975-af75-461eb2ddd020,"Delectus fugiat molestias dignissimos delectus impedit. Beatae nam unde est nulla.",2023-08-15 11:39:22,3,d0d325a1-c660-4a20-b5cd-cbef325dd834,16797f40-1c43-412d-9868-f5ae70ebf3c6
720f5fdf-875a-4645-973f-49cbed3f8e8e,"Dolorum quasi culpa veritatis recusandae eos. Corporis quo ad dolorum totam voluptatem.",2020-08-23 04:23:50,1,d0d325a1-c660-4a20-b5cd-cbef325dd834,e4398278-2b0d-4d98-8a87-1e8705135f55
2b18cc2f-ba16-499b-9273-dd865c80a75c,"Fugit molestias natus delectus velit officiis. Ad atque reiciendis adipisci inventore.",2021-06-27 20:21:19,1,d0d325a1-c660-4a20-b5cd-cbef325dd834,8ccef9c0-3df9-4a31-82b6-2697bc9d120f
1198a766-4cae-4cf7-b67f-2fc577e85016,"Iusto reprehenderit recusandae odit facilis. Repellat debitis eveniet.",2020-11-04 07:01:06,1,d0d325a1-c660-4a20-b5cd-cbef325dd834,6f1afa67-5a21-4052-b327-113c97c12fc3
32a30991-17f2-478f-929e-bc854332fb98,"Placeat earum tenetur debitis voluptatum non fugit. Maiores fuga expedita nemo.",2021-05-27 02:14:25,3,d0d325a1-c660-4a20-b5cd-cbef325dd834,c426cda9-589e-40a1-bab8-899e9205dc0f
97d85621-564e-4fd6-a41e-b7ce44e4d856,"Reiciendis autem mollitia velit amet. Amet mollitia doloremque facilis.",2025-01-11 21:55:17,1,d0d325a1-c660-4a20-b5cd-cbef325dd834,3aef1b5d-1270-43da-9ad9-c1a8f338791a
40256e86-1e62-406b-b305-3fb8f124a15e,"Possimus ipsa est incidunt at sunt quas suscipit. Dicta beatae repellat.",2020-05-08 15:21:59,5,d0d325a1-c660-4a20-b5cd-cbef325dd834,368301b3-f5ed-420d-88e3-ff74a1f86ddb
