review_id,review_comment,review_create_date_time,review_overall_classification,review_user_id,review_wifi_spot_id
2e060ec1-f065-44b8-89f2-53b35aecbc6c,"Nisi minus sint magnam. Accusamus facilis a et odit nisi quae. Saepe molestiae suscipit.",2022-06-30 22:36:09,5,d0d325a1-c660-4a20-b5cd-cbef325dd834,7f1d6dbd-5e6b-4b2d-9239-531a4862e356
b80cca1f-9025-4f85-8f2f-d1257bca4747,"Totam odio quas earum rerum. Iure quas tenetur rerum qui.",2023-09-26 15:17:54,1,d0d325a1-c660-4a20-b5cd-cbef325dd834,308e2066-d114-4f8b-aba1-7be6672530cd
291d881d-5b46-4fa5-8f15-d67221deffd4,"In nobis possimus eius. Dicta optio assumenda ducimus earum.",2022-05-04 20:24:57,5,d0d325a1-c660-4a20-b5cd-cbef325dd834,86136eff-23a3-4704-86ff-2550698e1465
b674d4c8-a973-4dae-8bd4-a3197f998540,"Maiores vero reprehenderit.",2020-01-28 21:59:23,2,d0d325a1-c660-4a20-b5cd-cbef325dd834,791afb15-613a-4245-97d8-0f6c19325177
ecc51fde-cc76-4bc1-96f4-d68f16f652bd,"Saepe rerum incidunt eos voluptatibus. Fugiat sed neque vel tenetur consectetur atque.",2024-10-10 17:53:22,2,d0d325a1-c660-4a20-b5cd-cbef325dd834,85c73107-ef2f-4e90-a542-d8c1c6cc8ad8
0e98d9b9-8eb9-4f26-b9d7-199ee7ce7a1d,"Asperiores quibusdam quisquam ut. Saepe sed odit officiis. Accusantium nemo assumenda error sed.",2025-03-03 07:03:58,2,d0d325a1-c660-4a20-b5cd-cbef325dd834,65b3e299-bf1f-4de7-b6ac-82e7b04a793e
e9df6264-33cc-4ba6-a903-44f72b94a267,"Temporibus neque quia eveniet incidunt magni modi officia.",2021-03-08 04:14:20,3,d0d325a1-c660-4a20-b5cd-cbef325dd834,16c219ac-9298-4626-8ec0-9212de4315e7
3a926127-73cf-4c1e-a2a3-5f2a3b9b7f21,"Impedit vel illo animi nihil expedita perferendis. Quod saepe minus illo tempore optio.",2025-02-07 13:06:34,4,d0d325a1-c660-4a20-b5cd-cbef325dd834,318d8ac5-1ca2-42a6-814e-a3b27135de0a
8540e792-630b-4b99-8724-7c226a2d2f84,"Delectus iusto odit totam fugit ex.",2022-04-15 00:47:47,2,d0d325a1-c660-4a20-b5cd-cbef325dd834,018e2e75-af71-4d1c-9121-d9ce9a629742
af9d88ca-bff2-4e9f-92cc-00bf9ac95bd6,"Incidunt deserunt sapiente fugit eligendi et. Quis nobis repellat adipisci repellat eveniet.",2022-11-01 13:55:32,1,d0d325a1-c660-4a20-b5cd-cbef325dd834,4d08118e-9f10-41e3-8111-d4e0d91faa3e
f57997c5-65aa-46fd-99e0-79b3ce8970eb,"Ad dignissimos repellendus tempore veritatis. At et perferendis quas est quae. Ipsum officiis quae.",2024-09-05 23:44:40,3,d0d325a1-c660-4a20-b5cd-cbef325dd834,e73860e5-de86-495f-99be-7deaffdef4ff
bf8c926c-ca7c-4484-8be9-7af2ba324786,"Aliquid quibusdam eveniet suscipit blanditiis voluptas tempora vel. Nisi fuga in expedita.",2021-07-05 03:50:14,3,d0d325a1-c660-4a20-b5cd-cbef325dd834,7598c657-cbeb-4bf3-aa2d-416f5ec9c88d
8855cacb-f983-412e-a07b-06eea13f35ff,"Soluta aliquam repudiandae. Saepe corporis quasi ad.",2022-05-27 04:47:46,1,d0d325a1-c660-4a20-b5cd-cbef325dd834,fca04801-a71f-447c-93f0-117588a76b14
e3e79296-9bd0-44ca-b1b0-b68928d8ba0f,"Odio veritatis repellendus architecto. Facilis consequuntur et ad.",2020-10-19 07:01:16,5,d0d325a1-c660-4a20-b5cd-cbef325dd834,e6895e39-80f0-436f-a05c-13c36f3fe19c
cefcd591-b4ec-49d9-9952-358bc4368716,"Reprehenderit sed culpa ea ad nulla debitis.",2021-08-07 06:39:25,1,d0d325a1-c660-4a20-b5cd-cbef325dd834,13a12595-eb1d-4710-b4ca-e13b838881c1
416f1e77-7003-489b-8928-6cc6d8baf12f,"Hic quas explicabo omnis. Quae rerum cum.",2022-04-14 08:28:29,5,d0d325a1-c660-4a20-b5cd-cbef325dd834,94fe5384-ac8f-4fed-9f6e-2b6586cd9ec1
a67e468b-08cf-4b3e-910e-3a52ad37418a,"Et odit sit sequi iusto ex. Corrupti quaerat quo nisi voluptas porro dolorum.",2021-05-30 04:12:07,4,d0d325a1-c660-4a20-b5cd-cbef325dd834,c02f7b11-7eac-44de-bba6-f8a15468d551
b75441d9-a970-4ab8-bace-ca29e3abea67,"Repellat placeat minus saepe at. Sapiente suscipit labore dicta.",2024-05-05 10:11:08,5,d0d325a1-c660-4a20-b5cd-cbef325dd834,e506460c-294e-41c8-88e6-c62becf043be
4ba6e52f-6ac7-4350-b69e-620acdb94cc1,"Odio similique perspiciatis natus autem. Cum quam fuga magni minima. Nemo quas quos rem.",2021-05-17 02:27:53,1,d0d325a1-c660-4a20-b5cd-cbef325dd834,5db15fa0-02d2-42f3-b218-2af83fe39b1b
ad31e595-8a24-4fd2-aa36-a2ac1193f93c,"Voluptates praesentium officiis. Est minus vitae.",2021-12-08 23:15:02,4,d0d325a1-c660-4a20-b5cd-cbef325dd834,9940e8d4-5a32-4a45-8c4e-213b19e08214
5b66adaa-3c49-4d12-9a4e-be2260304e60,"Illum distinctio quis delectus veniam.",2021-02-16 15:36:37,1,d0d325a1-c660-4a20-b5cd-cbef325dd834,9c2ea608-8bc7-439f-a2c5-5c9c3009c156
d65f28f1-fd0e-4491-8fbf-720e4ebc6784,"Officia deleniti commodi numquam id. Beatae enim quas iure repellat fugiat rem commodi.",2022-03-31 12:34:11,4,d0d325a1-c660-4a20-b5cd-cbef325dd834,9820cc25-2a9b-483f-bb8a-1454c74ab8ed
88191fc1-3e62-49f2-8084-a73c5642461b,"Magni eius vel asperiores culpa maxime quasi ab. Et labore eius.",2020-01-19 17:26:05,3,d0d325a1-c660-4a20-b5cd-cbef325dd834,a0b71ac3-e776-4b26-b051-627135175126
5789bdd5-c36a-4ecd-a83b-4c17256117ac,"Ipsum excepturi ad debitis eveniet quisquam. Rerum tempora illum mollitia.",2022-07-14 23:06:06,5,d0d325a1-c660-4a20-b5cd-cbef325dd834,989b4fb5-633e-4296-b0b8-2144fffe453c
d4173d40-aa7f-425a-867a-d365fc4c17d1,"Sed placeat est occaecati quisquam. Error ad voluptas rem sunt pariatur deserunt.",2023-01-03 07:48:09,2,d0d325a1-c660-4a20-b5cd-cbef325dd834,e509d188-b6cc-430f-8fe6-497c9248e4a2
8c74d61b-7e67-4a7b-94b5-71281c00f384,"Fugit reiciendis aliquid dolorum vel velit. Ratione sapiente provident.",2024-10-04 05:06:23,4,d0d325a1-c660-4a20-b5cd-cbef325dd834,b760620f-cfd1-4f96-b73d-cb9e0ab99d18
fcb8b762-3e0b-4cc0-b29a-754a40d34013,"Aspernatur nostrum expedita suscipit magnam hic. Asperiores ipsum beatae minus et a quibusdam.",2020-09-08 14:52:38,1,d0d325a1-c660-4a20-b5cd-cbef325dd834,aa99d898-d1fd-4ff7-8b62-d06c5e851f86
ff7b1f0c-324f-463a-978d-83b34a57d9a9,"Exercitationem ullam harum ipsum autem placeat ducimus iure.",2024-08-28 15:55:07,5,d0d325a1-c660-4a20-b5cd-cbef325dd834,74e6185e-7005-423f-8648-a5437be9b40b
0a0696ae-2c66-4ac0-8d53-d07bfc5625d8,"Ratione itaque est corporis nisi. Sequi tempora autem.",2021-01-22 09:09:03,1,d0d325a1-c660-4a20-b5cd-cbef325dd834,3d50d2aa-4b7c-4112-8e4e-c3cf3246bd1a
e5ca628d-7cc4-410f-95b0-b27e8dfaf3cb,"Distinctio sequi nam vero. Fuga porro ipsa dolore.",2024-05-06 23:40:34,4,d0d325a1-c660-4a20-b5cd-cbef325dd834,f34911e3-f5b0-4b2c-a913-27efcf0e56a8
5929029b-4b56-46a1-afab-b8a9a6ed0b2d,"Repellendus nulla vero non nam. Cupiditate optio quo. Rerum officia quaerat natus porro.",2024-08-24 00:50:33,2,d0d325a1-c660-4a20-b5cd-cbef325dd834,4ffb06a8-c705-4afb-b845-0370e1df1270
6839b319-6ae1-4096-915d-0006531d1c70,"Nam dicta possimus molestiae corporis magnam atque. Vel veniam vitae facere.",2021-08-03 03:21:39,1,d0d325a1-c660-4a20-b5cd-cbef325dd834,ab985176-4fa2-40a0-9eac-d623e0253ce3
9e7f878d-b0b0-4aed-a9ec-0613f7f0096f,"Iusto optio animi excepturi laborum.",2021-01-15 11:13:43,5,d0d325a1-c660-4a20-b5cd-cbef325dd834,1bb55835-16d3-46ed-9970-d7e70259089c
b02a23c0-cc92-4f55-9ed9-59d84a6f50f3,"Quam dicta fuga repellat nesciunt nihil deserunt. Cumque saepe impedit voluptate labore.",2020-12-08 09:22:50,1,d0d325a1-c660-4a20-b5cd-cbef325dd834,79805946-8ea7-44a1-83be-05e7bf8e6899
2877abd2-a28c-4791-bc29-4ddef6a59cb2,"Fugiat quia facere. Reprehenderit repellendus eius ea. Sapiente quod omnis id.",2022-03-15 13:21:40,4,d0d325a1-c660-4a20-b5cd-cbef325dd834,e3795635-b03b-4ad5-8d38-bcb5ca4c7155
83d531f7-c3cd-4dd4-9566-db4cf0636a71,"Illum ipsa voluptate placeat. Temporibus necessitatibus eius amet expedita.",2022-06-16 21:39:48,3,d0d325a1-c660-4a20-b5cd-cbef325dd834,2db710a9-56ef-4364-808b-da63f10fa3cd
e95f741f-6c38-4082-a818-b80d6f62922b,"Quod hic quidem praesentium aut odio laboriosam. Dolor veniam debitis asperiores.",2023-04-17 06:47:27,5,d0d325a1-c660-4a20-b5cd-cbef325dd834,7e816711-76b4-47b9-95bc-8565187273ee
efc9f7ee-d3dc-4997-8183-b4779e5af4a8,"Magni a voluptatibus. Debitis ex earum. Sapiente recusandae nihil suscipit.",2022-04-23 09:09:01,2,d0d325a1-c660-4a20-b5cd-cbef325dd834,58b2f445-f9e3-4524-aac0-700a67468b41
c3784da4-36b5-4ecc-82da-bd21a7209ffc,"Aliquam modi aliquam. Molestiae perferendis ab quasi cumque numquam ratione.",2022-11-18 15:25:47,4,d0d325a1-c660-4a20-b5cd-cbef325dd834,69a7f7eb-dc58-4e19-9873-305c5d16a8db
c3756306-899c-4596-a049-c2501f7b216d,"Quasi ad quis ut enim iure inventore fugit. Ipsa placeat quaerat id itaque quas doloremque.",2020-05-19 16:30:38,5,d0d325a1-c660-4a20-b5cd-cbef325dd834,6192d8a1-ef8d-4dd5-b8c0-8e6b4a842427
727a0947-1985-4b70-8a3b-14ebe1cda9e5,"Eaque perferendis rerum dolor dolore. Expedita atque neque ipsam sed nobis.",2020-12-17 02:41:09,2,d0d325a1-c660-4a20-b5cd-cbef325dd834,8ae788e7-3114-42c6-8a78-e79ee8c2f225
39df77a6-622b-4bf4-ac82-01d97d784529,"Quae quia cum.",2023-03-29 18:45:06,2,d0d325a1-c660-4a20-b5cd-cbef325dd834,db71867b-51e8-49cc-8773-718e21dd8448
b4c88f07-1dc6-41ea-ac82-48c3e60a28c5,"Ut saepe eaque repellat vero dolor. Commodi iste quasi debitis. Cumque dolores nemo fuga.",2022-03-12 08:11:53,1,d0d325a1-c660-4a20-b5cd-cbef325dd834,036406ae-9895-4a6e-91c6-cd183d43dd07
f9f23988-edc9-428a-b966-c6eeb843bba7,"Veniam delectus dolorum totam. Culpa perspiciatis error natus illo molestiae. A molestias autem.",2022-06-04 09:54:21,4,d0d325a1-c660-4a20-b5cd-cbef325dd834,8a6e6c12-e88a-44c5-922d-e65b0e80eb10
7f516bba-3ed4-4bc9-90df-303fe4579d71,"Mollitia recusandae voluptate voluptas at soluta reiciendis.",2021-08-03 01:05:35,5,d0d325a1-c660-4a20-b5cd-cbef325dd834,c1fcda33-b1f7-4d23-9d98-1947a99a95ee
63128792-7a5a-4703-91d6-52a93787bf16,"Asperiores expedita rem harum iure. Ea incidunt vitae.",2022-08-13 05:36:34,1,d0d325a1-c660-4a20-b5cd-cbef325dd834,3754ffca-7a8f-4a24-a8de-d5812bbece72
97f15fc9-fb60-4dfc-87ed-3189fdf8b50c,"Hic tenetur error maiores non. Inventore officia sequi optio adipisci.",2021-08-02 15:00:11,3,d0d325a1-c660-4a20-b5cd-cbef325dd834,75db3b2f-8235-4e42-ae7f-13e05ac21806
b045f31f-408e-41fb-9877-8e6a2cab78e7,"Rem architecto praesentium rerum. Optio suscipit expedita.",2020-04-06 08:41:52,2,d0d325a1-c660-4a20-b5cd-cbef325dd834,f21f1da0-8b9a-4d91-99bb-cc7b656d8c2d
60a28da7-ede9-4406-b679-c3c7a6466ece,"Aperiam voluptate ratione facere facere quisquam. Occaecati deserunt ipsa porro.",2023-10-18 05:26:57,5,d0d325a1-c660-4a20-b5cd-cbef325dd834,e9650a4a-c7a5-4007-93d5-bf74876a8506
254cf94a-707b-4443-873b-4816fa78c8a9,"Expedita occaecati necessitatibus. Ea odio cum impedit. Incidunt neque praesentium cumque eum.",2022-12-27 05:12:18,5,d0d325a1-c660-4a20-b5cd-cbef325dd834,af551b1b-8627-44eb-b1c6-d107af097ada
aef18cd7-7131-46e4-9157-79eeeb2d4207,"Omnis nisi porro tempore repellat voluptates cum. Natus animi officiis necessitatibus.",2025-01-15 10:32:07,4,d0d325a1-c660-4a20-b5cd-cbef325dd834,dbc76d88-0d49-4600-a920-46bb6ea15669
d587881e-49af-476e-a6be-1b02df839297,"Voluptates doloremque aut incidunt minus similique explicabo.",2024-09-25 05:07:43,3,d0d325a1-c660-4a20-b5cd-cbef325dd834,53463f11-c0a0-4cd9-9b08-2ab2bd3fc56c
f77862e5-be81-44ac-8704-b30c8b64b9aa,"Provident adipisci facere fuga assumenda. Perferendis ex maxime debitis et rem.",2024-10-20 05:23:25,1,d0d325a1-c660-4a20-b5cd-cbef325dd834,2194ff61-8209-4656-8960-730262dd9ff9
88edfb95-1de7-48ab-9011-418fcef8e797,"Ea deserunt unde in modi enim. Ipsam reprehenderit necessitatibus fugit.",2024-06-06 17:49:17,1,d0d325a1-c660-4a20-b5cd-cbef325dd834,b05d28d4-cb4f-471d-b6ff-b4bb656514a4
ba06de02-b0b2-4002-953a-d29736372c33,"Nulla laudantium iusto iusto. Quasi similique minima officiis quas magni.",2023-12-02 06:06:55,3,d0d325a1-c660-4a20-b5cd-cbef325dd834,19bb2d73-cf98-4df7-a898-80480b6276c7
09902b5d-a44f-4969-b397-6418a3884c24,"Autem animi ad voluptate minima eaque. Eum culpa ullam officia cum doloribus quo.",2024-02-29 08:28:00,1,d0d325a1-c660-4a20-b5cd-cbef325dd834,e5f87a10-c63d-4c42-8d42-12d2c5cd8284
a0750bce-45f3-47df-ac0e-6e0541b593ff,"Quaerat ullam itaque. In officia voluptatum molestiae.",2023-10-18 12:20:33,5,d0d325a1-c660-4a20-b5cd-cbef325dd834,3e55c003-2137-4be6-a27c-37d0a290bc26
e2a09bb7-01db-4084-b4eb-f8a6a5de21d8,"Rem expedita officiis non occaecati vel at corrupti. Reprehenderit optio repellendus odio ipsa.",2021-08-17 05:43:45,2,d0d325a1-c660-4a20-b5cd-cbef325dd834,4aca079c-ff21-4444-815f-5d397227dd89
3ed64070-bdd3-4ec9-af15-5133bb68df33,"Repellat dolorem rem temporibus nemo. Mollitia ab temporibus libero dicta labore corporis.",2024-09-20 11:12:53,3,d0d325a1-c660-4a20-b5cd-cbef325dd834,0abbd3c0-edeb-4a71-8cf5-0148cb5668ba
f5e3d12b-6b06-4f21-aa8c-e41a15d870c7,"Quos doloremque minima tempore vel. Occaecati molestiae facere voluptate voluptate suscipit itaque.",2024-12-31 03:41:30,2,d0d325a1-c660-4a20-b5cd-cbef325dd834,70597d8f-ca9d-48bf-a41a-c78fdbf16f75
034394f9-25a9-4bd6-8838-a0c9055f7d29,"Commodi dolor officiis unde esse. Quam error quia suscipit numquam soluta.",2023-05-30 00:42:41,4,d0d325a1-c660-4a20-b5cd-cbef325dd834,14ef25da-2d6d-47e4-9f0d-580f80690517
aba9c979-3778-4ac4-8e4d-f7494e33de8d,"Totam a alias perferendis excepturi. Quia tenetur suscipit velit.",2023-11-18 17:51:49,3,d0d325a1-c660-4a20-b5cd-cbef325dd834,0de5e552-26da-43b9-9908-5e14b64d53bb
f26cf868-0f28-4662-9a97-a592de9c5663,"Aperiam natus dolore laudantium eum. Quam repellat officiis sequi commodi provident et molestias.",2021-06-12 22:52:29,4,d0d325a1-c660-4a20-b5cd-cbef325dd834,239a486d-65fd-419d-bd02-9bf523e66aff
6903fccc-78e7-4c27-acb7-484af505d1a3,"Quo voluptas similique. Nostrum quam ex enim dolorum architecto eius recusandae.",2021-02-08 16:50:59,1,d0d325a1-c660-4a20-b5cd-cbef325dd834,ef36f2eb-c2ae-4c3f-b1a6-f8efc7b405d9
e8ade6ea-87cc-4503-b0e8-67489331422b,"A eligendi cumque at rem veritatis. Unde sed sit quis. Soluta magnam optio ea ut nam.",2024-07-20 01:30:13,5,d0d325a1-c660-4a20-b5cd-cbef325dd834,80bf48a8-f680-40f5-8eeb-8926cb0aa6fd
9f3eab37-ed65-48ff-9df2-5b9a9df0ad2c,"Est esse distinctio sit praesentium. Aut veniam ea dolor. Voluptas aliquam voluptatum.",2021-09-12 07:37:04,1,d0d325a1-c660-4a20-b5cd-cbef325dd834,8c2c3371-9e7b-4335-8d50-9da4a1b04670
24a1d803-8f4c-4891-8ff7-85a5d6e94689,"Commodi cumque sint tempore nulla. Ipsa atque ut. Doloribus modi mollitia.",2020-05-14 01:47:27,1,d0d325a1-c660-4a20-b5cd-cbef325dd834,371421ac-db45-49fd-9955-14fa6dd5eb21
ce68d48c-cd0b-452c-87cd-69a0fc34f20c,"Veniam ducimus recusandae provident velit dolorem.",2022-04-09 21:57:38,4,d0d325a1-c660-4a20-b5cd-cbef325dd834,c39c5042-5d86-47ff-bddb-cc964699b443
9d06dd5d-16cf-4f13-a344-f9fb14227fba,"Repellat delectus impedit. Corporis natus dolorum nisi esse.",2020-02-07 16:34:52,5,d0d325a1-c660-4a20-b5cd-cbef325dd834,63101c89-e031-4ed3-bccb-f03468c16f47
a6f01370-14d3-4f42-947b-54cff2deefe9,"Ipsa a voluptatibus a neque veritatis. Unde a reprehenderit id deleniti animi.",2024-05-13 00:44:44,2,d0d325a1-c660-4a20-b5cd-cbef325dd834,48ab8dc7-a6d1-4663-8b66-68cc60faffb2
1d697245-37f0-4f5f-9786-e7180cea051a,"Repudiandae dolorem quas laboriosam cum. Qui culpa aspernatur voluptate at nisi minima.",2022-09-09 13:33:44,3,d0d325a1-c660-4a20-b5cd-cbef325dd834,308996a7-7f00-424f-83b2-64e99ca06ca3
5a63baf9-8c03-4058-83d7-1356e407c6ca,"Odit velit at cumque. Possimus maiores id saepe. Quia quaerat unde dolore fuga quos ullam.",2020-11-23 20:17:48,1,d0d325a1-c660-4a20-b5cd-cbef325dd834,579bf60b-a4f8-4800-b96c-0f2bc860846e
516cf2c3-7fea-47d0-9536-9154f3cf0609,"Sint nisi nesciunt voluptatum.",2020-12-28 11:21:26,5,d0d325a1-c660-4a20-b5cd-cbef325dd834,446c6cc2-21db-45c1-b546-d47a512e7571
745c3efb-3161-43e7-bbdd-16acca4a44db,"Ratione illum quaerat temporibus. Deserunt eligendi modi.",2021-06-02 18:06:44,5,d0d325a1-c660-4a20-b5cd-cbef325dd834,21132c86-43b8-4422-b0d1-c0e61d08995e
cd69bcd5-737f-4837-980a-4e51f3e77044,"Culpa necessitatibus asperiores voluptatem rerum.",2023-02-21 09:56:02,4,d0d325a1-c660-4a20-b5cd-cbef325dd834,ca7e04c0-138c-4c15-99ef-c2abc269b0fd
33e80d0e-a630-4f92-a237-b75ca38fa261,"Rerum facilis accusantium distinctio assumenda numquam. Sit exercitationem vel amet.",2024-06-17 17:53:30,3,d0d325a1-c660-4a20-b5cd-cbef325dd834,e28bc58b-2467-4db1-949d-7ab95aeea682
fa1e5a2a-3103-4ffa-91fd-73a308f475a2,"Incidunt modi quaerat cupiditate. Aut adipisci ad perferendis quisquam.",2021-12-29 17:29:17,4,d0d325a1-c660-4a20-b5cd-cbef325dd834,45af4db1-20ca-4578-ace6-7213ce811639
74ea22f2-ccd1-4cdd-9b67-83697d98c21f,"Consequatur sint deserunt nostrum fugit quia. Sed ut omnis corrupti.",2021-02-11 10:25:49,3,d0d325a1-c660-4a20-b5cd-cbef325dd834,e5c0b9dd-8c5a-4396-9214-1d3eb2fc1c9f
161059e3-a993-4b9c-8160-25e8e410f586,"Voluptatum ut inventore assumenda facere rerum. Enim esse earum eligendi error non.",2022-07-01 07:57:07,1,d0d325a1-c660-4a20-b5cd-cbef325dd834,e1d11772-dedb-4301-bccd-a54b863f22b2
11092ba7-3b45-4de6-852d-0d1afb4ecac2,"Aspernatur animi facilis velit qui nostrum. Ea eius animi occaecati accusamus.",2021-09-01 17:06:38,1,d0d325a1-c660-4a20-b5cd-cbef325dd834,a750b5d9-e109-4bda-9bc6-c6d9c604f899
3014450b-4bbf-41d1-b432-cbd15965cbf1,"Quam modi corporis ex natus. Odio ipsam ea adipisci dolor.",2023-08-02 07:07:02,4,d0d325a1-c660-4a20-b5cd-cbef325dd834,d17939ee-c5e2-433c-8aa7-53d0908ed4ba
04fca7b3-214a-4bf9-aa3b-2f7ad1620cf0,"Totam laudantium sed perferendis. Odio repellat quaerat.",2022-11-13 21:02:47,1,d0d325a1-c660-4a20-b5cd-cbef325dd834,bfa5ed97-0f7b-4377-9b2f-562913bb863c
67546e79-8f10-47bc-bac3-bdbf648bf7ee,"Eius consectetur omnis fugiat eveniet deserunt quo. Enim quibusdam maxime repellat.",2021-11-19 11:55:57,3,d0d325a1-c660-4a20-b5cd-cbef325dd834,d1bb5607-d41d-45d4-9235-8731e7937e05
7b5f4691-2cf0-4870-b216-9610acbea47e,"Porro exercitationem neque rerum. Saepe modi tenetur ducimus iste unde.",2025-03-12 05:56:58,2,d0d325a1-c660-4a20-b5cd-cbef325dd834,de323275-07ec-44de-98f7-b78cbc682b5c
07e599c5-907f-41e4-a973-e862fa6d1664,"Temporibus incidunt numquam. Tempora quis amet.",2022-07-26 22:37:16,5,d0d325a1-c660-4a20-b5cd-cbef325dd834,12adba1e-2ad9-492e-9339-177370ef064e
68eeb26c-5c9b-4b69-9e36-06730b7d16b1,"Sunt maiores qui beatae ipsum.",2024-09-15 17:43:38,5,d0d325a1-c660-4a20-b5cd-cbef325dd834,a75376f2-1188-4efe-83b9-907d066d02df
ba0009d7-fe8b-4379-b879-d125040a56b4,"Quae harum aliquam quasi. Cum magnam excepturi fugit. Quam molestiae recusandae eos.",2021-09-30 18:11:55,1,d0d325a1-c660-4a20-b5cd-cbef325dd834,f641dd8d-2add-4949-86aa-ea3a763ad942
d821a019-43c3-4502-860c-6f581dbf0365,"Expedita quis voluptates ratione.",2025-01-23 20:18:02,1,d0d325a1-c660-4a20-b5cd-cbef325dd834,77b147d4-9669-4145-8b11-b9c4edcd41c6
1ecd7305-74eb-447a-8be2-f9ad426766a9,"Odio quaerat ad deleniti consequuntur. Dignissimos molestias eveniet alias.",2023-05-06 18:49:34,2,d0d325a1-c660-4a20-b5cd-cbef325dd834,ae7ac1d1-fb0d-44a9-ac27-0f3760bca3ef
01fee942-5d31-4eaa-835b-7a494d30418e,"Hic itaque sit. Ex quasi vel natus. Repellat maxime distinctio.",2021-04-11 13:59:31,5,d0d325a1-c660-4a20-b5cd-cbef325dd834,2820aad3-6d9a-4ffc-97e8-e6efb0e888e7
c42dab83-227e-443d-b812-0202f629e719,"Quam exercitationem nobis ad non est. Autem doloribus cupiditate explicabo possimus nostrum.",2022-01-30 09:47:16,1,d0d325a1-c660-4a20-b5cd-cbef325dd834,22dd5b5f-ff50-4f3f-8811-dc9f12730062
ffdfb043-1367-4619-9cfc-8a0aaca1e451,"Quam modi doloribus esse error minima dignissimos. Odio vero labore quos quo.",2020-06-03 07:51:31,1,d0d325a1-c660-4a20-b5cd-cbef325dd834,6be34d6b-8ec1-4a9a-82b1-5f57632aa309
e5363a31-32ec-4940-a0b7-9afe820a2e76,"Accusamus impedit voluptas officia dolore reiciendis. Fugiat iusto dolorem enim fugit.",2025-01-29 14:04:53,2,d0d325a1-c660-4a20-b5cd-cbef325dd834,eb3ec1b4-641c-4e09-88ae-64ca9f29da19
16908315-62e2-460b-bb0f-0b2a3ee41da5,"Assumenda praesentium asperiores commodi libero consequatur qui. Assumenda illum atque.",2022-04-11 10:54:16,2,d0d325a1-c660-4a20-b5cd-cbef325dd834,afe1b877-a9f4-4cb9-b681-2c611bc348dd
c1982204-7a5e-4d2d-ab88-0cd2a9520aff,"Eos sunt quo repudiandae dicta nihil. Hic quidem optio nisi quibusdam.",2022-12-15 06:04:39,1,d0d325a1-c660-4a20-b5cd-cbef325dd834,fa16cb4d-2540-49e6-bf78-9ef91d0d5eb8
b05c1f10-3828-4899-bf3f-71b48420eb1f,"Rem ipsam alias repudiandae nisi aliquam sapiente. Architecto accusantium harum repudiandae.",2021-06-13 04:48:43,5,d0d325a1-c660-4a20-b5cd-cbef325dd834,b8b2a782-4620-415d-814f-b0a47332708b
320b1570-d531-46d1-8853-c5b041af1050,"Doloribus natus fugiat. Nemo cum magni.",2023-11-01 00:44:59,5,d0d325a1-c660-4a20-b5cd-cbef325dd834,b641f331-6062-4fc5-adef-158422cf8e5c
1bf04bef-e2ed-4d4f-b981-3f261d080b52,"Aliquam vel quaerat distinctio. Velit at doloremque vitae.",2020-12-12 03:30:17,4,d0d325a1-c660-4a20-b5cd-cbef325dd834,6484af0c-4994-44e7-9d52-e3b983b2a6e8
71b8f2ed-837d-426c-9185-847d1c643808,"Consectetur minus nostrum id recusandae. Officia omnis incidunt quo ratione placeat.",2023-07-08 19:18:45,5,d0d325a1-c660-4a20-b5cd-cbef325dd834,7da8422e-f689-4ef1-b3fb-bba4903107d3
601c1683-52b9-4f14-af1e-ba61bcb1b58e,"Itaque earum adipisci accusantium aliquam tempora sed. Laboriosam temporibus accusantium ducimus.",2020-05-20 11:51:48,3,d0d325a1-c660-4a20-b5cd-cbef325dd834,8de17c70-6c6b-4bba-b7dd-31ecbc9cabc1
ecd75d4e-14a2-49f0-b33b-03fede94ff92,"Quos repudiandae soluta quas repudiandae illum sit sapiente. In porro eum vel nihil.",2021-06-21 18:18:14,3,d0d325a1-c660-4a20-b5cd-cbef325dd834,a17840cc-92ab-4a14-920c-75de1b3794bb
fc03e4c2-261e-40b1-817a-21467eea91e8,"Fuga a corporis. Quae aspernatur enim molestias aliquam et.",2020-02-21 09:59:38,3,d0d325a1-c660-4a20-b5cd-cbef325dd834,e2a6fc4a-157d-402c-a804-44cc06c8e352
b8e9bb50-c680-451d-9277-09dbf8d71875,"Ipsa est quo ipsam. Repellendus laborum reprehenderit.",2021-11-11 00:30:35,1,d0d325a1-c660-4a20-b5cd-cbef325dd834,02e267ca-80c9-4bbb-8d1f-9e655870261c
f8215bb5-11e1-44a3-8b1c-30b6b56c99c2,"Repellat unde fugiat maiores molestias. Iste placeat voluptas iure ullam nisi enim.",2020-03-25 03:17:20,4,d0d325a1-c660-4a20-b5cd-cbef325dd834,90ea567c-f43f-4f81-a9c0-a23cb1c95842
ea977b48-0f98-4cd8-a9f1-7e44f31d3afb,"Ex quaerat voluptatem.",2022-09-06 22:11:36,2,d0d325a1-c660-4a20-b5cd-cbef325dd834,60e56b28-1dd0-4142-b9b3-3bd86f2803de
1c300343-8e61-48e3-886b-76216b266de5,"Adipisci repellendus enim tempora porro optio. Doloribus consequatur earum ratione dolore.",2020-07-25 02:30:36,2,d0d325a1-c660-4a20-b5cd-cbef325dd834,9494135f-94cb-4a21-928f-96a7b1c6d615
d86f57f5-7fa8-402b-8d54-c9fbeb0f3660,"Blanditiis accusantium recusandae vero id. Aliquid occaecati dolores sint ex.",2023-07-26 10:48:33,2,d0d325a1-c660-4a20-b5cd-cbef325dd834,dcea2801-2d34-4e5d-910e-bdd152f58026
16e5ed19-b610-4be4-8160-69c22582f3f7,"Occaecati ex enim explicabo non nobis voluptatibus. Pariatur quod nostrum enim tenetur.",2020-04-09 03:42:43,4,d0d325a1-c660-4a20-b5cd-cbef325dd834,64918a46-2711-421f-a683-8db22d773f10
af94a7ad-72ef-4288-a76a-bc0d05125a1d,"Saepe suscipit sit sit amet asperiores cupiditate. Dolor ex hic aliquam.",2025-03-27 07:31:21,4,d0d325a1-c660-4a20-b5cd-cbef325dd834,07b0b3a6-583e-4f4e-82dc-7a382706b385
0166e567-0ac3-42b6-a609-96d1274754ff,"Neque alias quaerat aliquid. Corporis ex aspernatur tenetur.",2021-12-12 21:34:41,1,d0d325a1-c660-4a20-b5cd-cbef325dd834,259cbacc-347f-4646-96de-837f27448e38
adc4e86f-e603-448d-a586-30231c0d3d76,"Id eveniet iure facilis. Cum pariatur ea blanditiis porro quasi adipisci.",2021-04-12 08:20:28,1,d0d325a1-c660-4a20-b5cd-cbef325dd834,8a412572-15e6-4774-a461-bce26118c6f6
ca8a7443-6bf7-4f46-a0bc-7d27012335b3,"Officia a dolores quaerat molestias debitis consequatur. Velit dolorum omnis eaque.",2023-02-09 10:13:31,5,d0d325a1-c660-4a20-b5cd-cbef325dd834,393175bc-bddb-4adb-9d7b-ecc8b13e9eca
b99dd02c-90b8-44ae-87ea-88c3ddede764,"Laboriosam voluptas nesciunt sit soluta. Repudiandae delectus dignissimos iure soluta ullam.",2022-05-26 13:55:35,2,d0d325a1-c660-4a20-b5cd-cbef325dd834,bcf4f270-b02d-4746-b70b-558efa6f3a88
fe76f25e-5ad5-4950-8c13-9b5eeca6f4ae,"Beatae laudantium ipsa possimus commodi non sint voluptates. Natus mollitia labore expedita.",2022-10-08 17:43:02,1,d0d325a1-c660-4a20-b5cd-cbef325dd834,3d9c13c3-f0b2-4ea4-bb57-79e8c415ef79
e95c65ac-4e0e-4c0a-8c83-ecf4f7d0f0c7,"Eos quae nobis tempora consequuntur nam. Aut qui adipisci. Alias commodi iure consequatur fugit.",2020-12-18 06:40:41,4,d0d325a1-c660-4a20-b5cd-cbef325dd834,18b0cbe1-8508-4103-bcc4-c680bf270e60
496a9483-0cc2-48b8-89f2-8f56f71fb435,"Laudantium quaerat eaque vel eius rerum ad.",2021-05-02 05:33:21,5,d0d325a1-c660-4a20-b5cd-cbef325dd834,9a8e8730-ddd2-48a4-a32d-d00f926d6035
a9246e1a-6459-4a5c-926d-4b968ce4af0c,"Dolor vitae quae sunt quod. Minima itaque temporibus culpa occaecati dolores.",2020-02-21 15:29:00,4,d0d325a1-c660-4a20-b5cd-cbef325dd834,28c6e902-4e77-4d49-bf8e-16655ac686b1
ff570a04-0519-4c1f-bd54-c62e221f62a5,"Tempora voluptates natus voluptatum. Numquam dolorum ex.",2023-12-19 18:31:53,5,d0d325a1-c660-4a20-b5cd-cbef325dd834,298fd510-c509-4e2f-8624-6a30b25a5c9c
04ebdf47-e52c-4f30-b757-6d3b79d5fe11,"Explicabo distinctio numquam laborum. Accusantium commodi laudantium alias et vero.",2021-05-05 14:53:02,5,d0d325a1-c660-4a20-b5cd-cbef325dd834,282e593c-fcbf-4a4d-a0e7-f40d3c1110ec
8f182f0e-9cca-4fc5-ac8c-a863364fc154,"Tenetur vel impedit labore pariatur commodi. Deleniti sapiente vel in.",2023-02-01 09:40:10,2,d0d325a1-c660-4a20-b5cd-cbef325dd834,d2c338d7-e030-4b63-b653-29abcdcc846a
90634d2b-892e-486f-988c-a387eb03868f,"Aspernatur quae ipsam sunt. Dolor sint laborum ipsam. Consectetur praesentium dignissimos.",2022-04-25 09:17:17,1,d0d325a1-c660-4a20-b5cd-cbef325dd834,4002f451-4865-4bcf-a905-3a8142ad1c50
46a3b85d-06c4-4a8d-a5f0-3bc90b89722d,"Minus cumque mollitia porro sequi laboriosam libero facilis. Cum fugiat mollitia esse excepturi.",2022-01-25 23:06:04,1,d0d325a1-c660-4a20-b5cd-cbef325dd834,aaff03af-e513-4b73-b889-85d60e5e9404
fdd63afc-dcea-481c-b809-d6894484a413,"Maxime cumque culpa vitae reiciendis temporibus. Cupiditate quibusdam nobis deserunt.",2025-02-01 22:02:29,4,d0d325a1-c660-4a20-b5cd-cbef325dd834,5eed6e61-5693-462f-8432-1c44dcf457eb
11eca606-e1e9-4cfd-94da-5565c2b14607,"Quisquam deleniti occaecati at.",2023-04-08 01:33:30,3,d0d325a1-c660-4a20-b5cd-cbef325dd834,27c6d437-183a-42af-8ffa-3a47f8f672b8
